newDATANUMBER,oldDATANUMBER,DATABASE,Number,Proben ID,Event label,Device,Station,Depth(m),Date,Year,Month,Day,Time(UTC),lon,lat,MgDVP,Chla,Diva,Chlida,MTChla,Chlb,Divb,Chlidb,MTChlb,Chl c1+2,Chl c3,MTChlc,Peridinin,19-But,19-Hex,Fuco,Prasino,MPSC,Zea,Lutein,Diadino,Diato,a-caroten,b-caroten,Neo,MTViola_Neo,Allo,MTZea_Lut,Viola,MTDD_DT,MTAlpha_Beta,MPPC,NumberPPC,MYFLAG5,MTC,MAP,MTP,M(TChla-AP)/TP%,MYFLAG3,MDP,MfdChla
25,25,01_02_V3_CLIVAR,1,NA,NA,NA,2,6.6,30/10/2001,2001,10,30,03:43,146.3485,-44.006,NA,0.763,0,0.005,0.768,0.522,0,NA,0.522,0,0.09,0.201,0.044,0.047,0,0.165,0.055,0.311,0.134,0,0.13,0.007,0,NA,0.047,0.068,0.015,0.134,0.021,0.137,0,0.307,5,0,0.618,1.341,2.109,27.16927454,3,0.9626,0.241689175
25,25,01_02_V3_CLIVAR,1,NA,NA,NA,2,26.3,30/10/2001,2001,10,30,03:43,146.3485,-44.006,NA,0.339,0,0.001,0.34,0.321,0,NA,0.321,0,0.043,0.082,0.018,0.029,0,0.064,0.032,0.143,0.037,0.001,0.031,0.002,0,NA,0.027,0.034,0.011,0.038,0.007,0.033,0,0.089,5,0,0.232,0.635,0.975,30.25641026,3,0.4884,0.184766585
25,25,01_02_V3_CLIVAR,1,NA,NA,NA,2,50.7,30/10/2001,2001,10,30,03:43,146.3485,-44.006,NA,0.115,0,0.001,0.116,0.13,0,NA,0.13,0,0.029,0.062,0.005,0.021,0,0.028,0.015,0.069,0.01,0.001,0.012,0.001,0,NA,0.011,0.014,0.007,0.011,0.003,0.013,0,0.034,5,0,0.103,0.295,0.411,43.55231144,3,0.19798,0.199414082
25,25,01_02_V3_CLIVAR,1,NA,NA,NA,2,76.1,30/10/2001,2001,10,30,03:43,146.3485,-44.006,NA,0.069,0,0.001,0.07,0.07,0,NA,0.07,0,0.018,0.039,0.004,0.015,0,0.019,0.009,0.047,0.006,0,0.009,0.001,0,NA,0.004,0.006,0.007,0.006,0.002,0.01,0,0.025,5,0,0.072,0.181,0.251,44.22310757,3,0.11774,0.227535247
25,25,01_02_V3_CLIVAR,1,NA,NA,NA,2,101.4,30/10/2001,2001,10,30,03:43,146.3485,-44.006,NA,0.048,0,0.001,0.049,0.043,0,NA,0.043,0,0.014,0.031,0.002,0.01,0,0.015,0.007,0.034,0.006,0,0.008,0.001,0,NA,0.003,0.003,0.006,0.006,0,0.009,0,0.021,5,0,0.055,0.129,0.178,44.94382022,3,0.07966,0.265503389
25,25,01_02_V3_CLIVAR,1,NA,NA,NA,2,127,30/10/2001,2001,10,30,03:43,146.3485,-44.006,NA,0.041,0,0.001,0.042,0.037,0,NA,0.037,0,0.013,0.033,0,0.009,0,0.013,0.006,0.028,0.004,0,0.006,0,0,NA,0.002,0.003,0.004,0.004,0.001,0.006,0,0.015,5,0,0.043,0.113,0.155,45.80645161,3,0.06469,0.283351368
25,25,01_02_V3_CLIVAR,1,NA,NA,NA,2,152,30/10/2001,2001,10,30,03:43,146.3485,-44.006,NA,0.026,0,0.001,0.027,0.026,0,NA,0.026,0,0.009,0.017,0.002,0.006,0,0.01,0.005,0.023,0.003,0,0.005,0,0,NA,0,0.001,0.003,0.003,0.001,0.005,0,0.012,5,0,0.035,0.078,0.105,48.57142857,3,0.04966,0.283930729
25,25,01_02_V3_CLIVAR,1,NA,NA,NA,2,175.4,30/10/2001,2001,10,30,03:43,146.3485,-44.006,NA,0.027,0,0.001,0.028,0.027,0,NA,0.027,0,0.008,0.016,0.002,0.007,0,0.011,0.005,0.025,0.003,0,0.005,0,0,NA,0.004,0.005,0.003,0.003,0.001,0.005,0,0.012,5,0,0.037,0.08,0.108,48.14814815,3,0.05243,0.295823002
25,25,01_02_V3_CLIVAR,1,NA,NA,NA,2,201.5,30/10/2001,2001,10,30,03:43,146.3485,-44.006,NA,0.017,0,0.001,0.018,0.023,0,NA,0.023,0,0.01,0.03,0,0.005,0,0.009,0.005,0.019,0.002,0,0.005,0,0,NA,0.003,0.003,0.004,0.002,0,0.005,0,0.011,5,0,0.03,0.083,0.101,64.35643564,3,0.04179,0.303661163
25,25,01_02_V3_CLIVAR,1,NA,NA,NA,2,225.5,30/10/2001,2001,10,30,03:43,146.3485,-44.006,NA,0.018,0,0,0.018,0.021,0,NA,0.021,0,0.007,0.016,0,0.004,0,0.007,0.004,0.015,0.002,0,0.004,0,0,NA,0,0.001,0.003,0.002,0.001,0.004,0,0.01,5,0,0.025,0.062,0.08,55,3,0.036,0.274166667
25,25,01_02_V3_CLIVAR,1,NA,NA,NA,2,250.7,30/10/2001,2001,10,30,03:43,146.3485,-44.006,NA,0.016,0,0.001,0.017,0.021,0,NA,0.021,0,0.007,0.019,0.001,0.004,0,0.008,0.004,0.017,0.001,0,0.004,0,0,NA,0.002,0.002,0.003,0.001,0,0.004,0,0.008,5,0,0.025,0.065,0.082,58.53658537,3,0.03796,0.2971549
25,25,01_02_V3_CLIVAR,1,NA,NA,NA,2,305.5,30/10/2001,2001,10,30,03:43,146.3485,-44.006,NA,0.013,0,0,0.013,0.018,0,NA,0.018,0,0.004,0.011,0.002,0.004,0,0.006,0.004,0.016,0.002,0,0.004,0,0,NA,0,0.001,0.002,0.002,0.001,0.004,0,0.009,5,0,0.025,0.054,0.067,61.19402985,3,0.03378,0.25044405
25,25,01_02_V3_CLIVAR,1,NA,NA,NA,3,5.2,30/10/2001,2001,10,30,06:13,146.306,-44.05283,NA,1.332,0,0.008,1.34,0.882,0,NA,0.882,0,0.1,0.245,0.059,0.065,0,0.279,0.094,0.497,0.217,0,0.152,0.008,0,NA,0.079,0.111,0.048,0.217,0.032,0.16,0,0.457,5,0,0.954,2.081,3.421,21.66033324,3,1.60557,0.245015789
25,25,01_02_V3_CLIVAR,1,NA,NA,NA,3,26.8,30/10/2001,2001,10,30,06:13,146.306,-44.05283,NA,0.907,0,0.005,0.912,0.645,0,NA,0.645,0,0.07,0.173,0.044,0.043,0,0.21,0.07,0.367,0.163,0,0.111,0.006,0,NA,0.063,0.086,0.028,0.163,0.023,0.117,0,0.331,5,0,0.698,1.516,2.428,24.87644152,3,1.18162,0.250588176
25,25,01_02_V3_CLIVAR,1,NA,NA,NA,3,51.1,30/10/2001,2001,10,30,06:13,146.306,-44.05283,NA,0.811,0,0.008,0.819,0.579,0,NA,0.579,0,0.081,0.185,0.038,0.048,0,0.192,0.062,0.34,0.13,0,0.081,0.005,0,NA,0.056,0.073,0.038,0.13,0.017,0.086,0,0.271,5,0,0.611,1.375,2.194,25.34184139,3,1.06049,0.25527822
25,25,01_02_V3_CLIVAR,1,NA,NA,NA,3,75.4,30/10/2001,2001,10,30,06:13,146.306,-44.05283,NA,0.131,0,0.001,0.132,0.138,0,NA,0.138,0,0.038,0.07,0.01,0.035,0,0.044,0.018,0.107,0.014,0.001,0.017,0.002,0,NA,0.013,0.016,0.01,0.015,0.003,0.019,0,0.047,5,0,0.154,0.362,0.494,46.55870445,3,0.24581,0.252390057
25,25,01_02_V3_CLIVAR,1,NA,NA,NA,3,99.9,30/10/2001,2001,10,30,06:13,146.306,-44.05283,NA,0.234,0,0.001,0.235,0.251,0,NA,0.251,0,0.035,0.063,0.012,0.026,0,0.055,0.027,0.12,0.02,0,0.017,0.001,0,NA,0.022,0.027,0.012,0.02,0.005,0.018,0,0.055,5,0,0.175,0.489,0.724,35.08287293,3,0.38148,0.203287197
25,25,01_02_V3_CLIVAR,1,NA,NA,NA,3,148.6,30/10/2001,2001,10,30,06:13,146.306,-44.05283,NA,0.031,0,0.001,0.032,0.036,0,NA,0.036,0,0.007,0.013,0.001,0.005,0,0.011,0.005,0.022,0.003,0,0.004,0,0,NA,0.003,0.003,0.006,0.003,0,0.004,0,0.013,5,0,0.035,0.084,0.116,44.82758621,3,0.06121,0.253389969
25,25,01_02_V3_CLIVAR,1,NA,NA,NA,4,6.3,30/10/2001,2001,10,30,08:37,146.236,-44.11083,NA,0.864,0,0.006,0.87,0.732,0,NA,0.732,0,0.066,0.149,0.042,0.036,0,0.151,0.077,0.306,0.18,0.003,0.103,0.005,0,NA,0.06,0.086,0.022,0.183,0.026,0.108,0,0.339,5,0,0.645,1.526,2.396,27.37896494,3,1.19205,0.17860828
25,25,01_02_V3_CLIVAR,1,NA,NA,NA,4,26.1,30/10/2001,2001,10,30,08:37,146.236,-44.11083,NA,0.942,0,0.005,0.947,0.735,0,NA,0.735,0,0.07,0.156,0.047,0.041,0,0.162,0.079,0.329,0.181,0,0.111,0.006,0,NA,0.068,0.095,0.024,0.181,0.027,0.117,0,0.349,5,0,0.678,1.569,2.516,24.7217806,3,1.22145,0.187007245
25,25,01_02_V3_CLIVAR,1,NA,NA,NA,4,51.9,30/10/2001,2001,10,30,08:37,146.236,-44.11083,NA,0.797,0,0.003,0.8,0.664,0,NA,0.664,0,0.066,0.142,0.038,0.035,0,0.139,0.073,0.285,0.151,0,0.088,0.005,0,NA,0.063,0.088,0.02,0.151,0.025,0.093,0,0.289,5,0,0.574,1.38,2.18,26.60550459,3,1.07432,0.182431678
25,25,01_02_V3_CLIVAR,1,NA,NA,NA,4,76.5,30/10/2001,2001,10,30,08:37,146.236,-44.11083,NA,0.176,0,0.001,0.177,0.18,0,NA,0.18,0,0.037,0.06,0.008,0.025,0,0.053,0.02,0.106,0.012,0,0.015,0.002,0,NA,0.014,0.018,0.006,0.012,0.004,0.017,0,0.039,5,0,0.145,0.385,0.562,37.01067616,3,0.29048,0.257263839
25,25,01_02_V3_CLIVAR,1,NA,NA,NA,4,102.2,30/10/2001,2001,10,30,08:37,146.236,-44.11083,NA,0.111,0,0.002,0.113,0.119,0,NA,0.119,0,0.025,0.044,0.006,0.024,0,0.047,0.017,0.094,0.008,0,0.016,0,0,NA,0.014,0.016,0.008,0.008,0.002,0.016,0,0.034,5,0,0.128,0.291,0.404,44.05940594,3,0.215,0.308232558
25,25,01_02_V3_CLIVAR,1,NA,NA,NA,4,151,30/10/2001,2001,10,30,08:37,146.236,-44.11083,NA,0.084,0,0.003,0.087,0.08,0,NA,0.08,0,0.023,0.039,0.003,0.016,0,0.032,0.01,0.061,0.006,0,0.009,0,0,NA,0.008,0.01,0.008,0.006,0.002,0.009,0,0.025,5,0,0.086,0.205,0.292,40.4109589,3,0.14571,0.309656166
25,25,01_02_V3_CLIVAR,1,NA,NA,NA,5,10.4,31/10/2001,2001,10,31,15:08,146.221,-44.37033,NA,0.593,0,0.002,0.595,0.367,0,NA,0.367,0,0.067,0.14,0.028,0.047,0,0.099,0.039,0.213,0.147,0,0.075,0.007,0,NA,0.039,0.051,0.021,0.147,0.012,0.082,0,0.262,5,0,0.475,0.982,1.577,24.54026633,3,0.70521,0.197941039
25,25,01_02_V3_CLIVAR,1,NA,NA,NA,5,30.9,31/10/2001,2001,10,31,15:08,146.221,-44.37033,NA,0.496,0,0.004,0.5,0.303,0,NA,0.303,0,0.047,0.1,0.025,0.031,0,0.082,0.031,0.169,0.108,0,0.055,0.003,0,NA,0.028,0.038,0.016,0.108,0.01,0.058,0,0.192,5,0,0.361,0.764,1.264,20.88607595,3,0.57023,0.20276029
25,25,01_02_V3_CLIVAR,1,NA,NA,NA,5,44.8,31/10/2001,2001,10,31,15:08,146.221,-44.37033,NA,0.445,0,0.001,0.446,0.388,0,NA,0.388,0,0.049,0.095,0.021,0.032,0,0.099,0.042,0.194,0.062,0,0.037,0.002,0,NA,0.036,0.047,0.018,0.062,0.011,0.039,0,0.13,5,0,0.324,0.807,1.253,28.81085395,3,0.6364,0.21934318
25,25,01_02_V3_CLIVAR,1,NA,NA,NA,5,59.9,31/10/2001,2001,10,31,15:08,146.221,-44.37033,NA,0.152,0,0.001,0.153,0.177,0,NA,0.177,0,0.034,0.059,0.007,0.027,0,0.05,0.022,0.106,0.01,0,0.014,0,0,NA,0.015,0.019,0.008,0.01,0.004,0.014,0,0.036,5,0,0.142,0.378,0.531,42.37288136,3,0.28199,0.250008866
25,25,01_02_V3_CLIVAR,1,NA,NA,NA,5,85.1,31/10/2001,2001,10,31,15:08,146.221,-44.37033,NA,0.053,0,0,0.053,0.066,0,NA,0.066,0,0.01,0.02,0.001,0.01,0,0.019,0.009,0.039,0.005,0,0.005,0.001,0,NA,0.004,0.005,0.005,0.005,0.001,0.006,0,0.017,5,0,0.056,0.142,0.195,45.64102564,3,0.10566,0.25354912
25,25,01_02_V3_CLIVAR,1,NA,NA,NA,5,102,31/10/2001,2001,10,31,15:08,146.221,-44.37033,NA,0.016,0,0,0.016,0.025,0,NA,0.025,0,0.004,0.008,0,0.005,0,0.007,0.004,0.016,0.002,0,0.004,0,0,NA,0.002,0.002,0.002,0.002,0,0.004,0,0.008,5,0,0.024,0.057,0.073,56.16438356,3,0.03979,0.248052274
25,25,01_02_V3_CLIVAR,1,NA,NA,NA,5,125.6,31/10/2001,2001,10,31,15:08,146.221,-44.37033,NA,0.038,0,0.001,0.039,0.036,0,NA,0.036,0,0.009,0.017,0.001,0.008,0,0.018,0.006,0.033,0.004,0,0.006,0.001,0,NA,0.003,0.004,0.004,0.004,0.001,0.007,0,0.016,5,0,0.049,0.102,0.141,44.68085106,3,0.07179,0.353531132
25,25,01_02_V3_CLIVAR,1,NA,NA,NA,5,151,31/10/2001,2001,10,31,15:08,146.221,-44.37033,NA,0.016,0,0.001,0.017,0.018,0,NA,0.018,0,0.004,0.008,0,0.004,0,0.01,0.003,0.017,0.002,0,0.003,0,0,NA,0,0,0.003,0.002,0,0.003,0,0.008,5,0,0.025,0.051,0.068,50,3,0.0372,0.379032258
25,25,01_02_V3_CLIVAR,1,NA,NA,NA,8,6.4,11/1/01,2001,11,1,00:41,145.643,-43.11667,NA,0.36,0,0.001,0.361,0.228,0,NA,0.228,0,0.049,0.094,0.015,0.034,0,0.054,0.025,0.128,0.068,0,0.05,0.002,0,NA,0.021,0.029,0.016,0.068,0.008,0.052,0,0.144,5,0,0.272,0.594,0.955,24.39790576,3,0.40755,0.186823703
25,25,01_02_V3_CLIVAR,1,NA,NA,NA,8,15.7,11/1/01,2001,11,1,00:41,145.643,-43.11667,NA,0.438,0,0.001,0.439,0.254,0,NA,0.254,0,0.049,0.097,0.016,0.036,0,0.058,0.024,0.134,0.074,0,0.057,0.003,0,NA,0.021,0.029,0.019,0.074,0.008,0.06,0,0.161,5,0,0.295,0.646,1.085,19.07834101,3,0.44852,0.182333006
25,25,01_02_V3_CLIVAR,1,NA,NA,NA,8,30.7,11/1/01,2001,11,1,00:41,145.643,-43.11667,NA,0.452,0,0.001,0.453,0.254,0,NA,0.254,0,0.059,0.109,0.016,0.036,0,0.057,0.024,0.133,0.066,0,0.046,0.002,0,NA,0.021,0.028,0.014,0.066,0.007,0.048,0,0.135,5,0,0.268,0.631,1.084,16.42066421,3,0.43723,0.183816298
25,25,01_02_V3_CLIVAR,1,NA,NA,NA,8,47.2,11/1/01,2001,11,1,00:41,145.643,-43.11667,NA,0.417,0,0.001,0.418,0.235,0,NA,0.235,0,0.049,0.093,0.015,0.034,0,0.056,0.023,0.128,0.003,0.004,0.04,0.001,0,NA,0.02,0.027,0.015,0.007,0.007,0.041,0,0.07,5,0,0.198,0.526,0.944,11.44067797,3,0.36094,0.218762121
25,25,01_02_V3_CLIVAR,1,NA,NA,NA,8,61.3,11/1/01,2001,11,1,00:41,145.643,-43.11667,NA,0.406,0,0.002,0.408,0.236,0,NA,0.236,0,0.052,0.1,0.018,0.035,0,0.057,0.022,0.132,0.064,0,0.04,0.002,0,NA,0.02,0.026,0.016,0.064,0.006,0.042,0,0.128,5,0,0.26,0.596,1.004,18.7250996,3,0.421,0.190902613
25,25,01_02_V3_CLIVAR,1,NA,NA,NA,8,76.9,11/1/01,2001,11,1,00:41,145.643,-43.11667,NA,0.391,0,0.001,0.392,0.231,0,NA,0.231,0,0.046,0.089,0.016,0.035,0,0.054,0.022,0.127,0.062,0,0.039,0.002,0,NA,0.021,0.027,0.015,0.062,0.006,0.041,0,0.124,5,0,0.251,0.571,0.963,18.58774663,3,0.40658,0.187269418
25,25,01_02_V3_CLIVAR,1,NA,NA,NA,8,90.8,11/1/01,2001,11,1,00:41,145.643,-43.11667,NA,0.358,0,0.001,0.359,0.223,0,NA,0.223,0,0.046,0.087,0.017,0.033,0,0.052,0.022,0.124,0.059,0,0.037,0.002,0,NA,0.019,0.025,0.015,0.059,0.006,0.039,0,0.119,5,0,0.243,0.553,0.912,21.27192982,3,0.39381,0.186181153
25,25,01_02_V3_CLIVAR,1,NA,NA,NA,8,106.5,11/1/01,2001,11,1,00:41,145.643,-43.11667,NA,0.326,0,0.001,0.327,0.188,0,NA,0.188,0,0.041,0.077,0.015,0.029,0,0.045,0.017,0.106,0.052,0,0.032,0.001,0,NA,0.016,0.02,0.013,0.052,0.004,0.033,0,0.102,5,0,0.208,0.473,0.8,18.25,3,0.33715,0.188195165
25,25,01_02_V3_CLIVAR,1,NA,NA,NA,8,120.6,11/1/01,2001,11,1,00:41,145.643,-43.11667,NA,0.229,0,0.002,0.231,0.156,0,NA,0.156,0,0.033,0.062,0.01,0.023,0,0.039,0.018,0.09,0.047,0,0.025,0.001,0,NA,0.014,0.018,0.012,0.047,0.004,0.026,0,0.089,5,0,0.179,0.397,0.628,26.43312102,3,0.28232,0.194778974
25,25,01_02_V3_CLIVAR,1,NA,NA,NA,8,150,11/1/01,2001,11,1,00:41,145.643,-43.11667,NA,0.019,0,0,0.019,0.029,0,NA,0.029,0,0.005,0.009,0,0.006,0,0.007,0.006,0.019,0.003,0,0.005,0,0,NA,0.003,0.004,0.004,0.003,0.001,0.005,0,0.013,5,0,0.032,0.07,0.089,57.30337079,3,0.04624,0.213451557
25,25,01_02_V3_CLIVAR,1,NA,NA,NA,8,249.4,11/1/01,2001,11,1,00:41,145.643,-43.11667,NA,0.023,0,0,0.023,0.026,0,NA,0.026,0,0.006,0.012,0.001,0.007,0,0.009,0.004,0.021,0.003,0,0.005,0,0,NA,0.003,0.004,0.006,0.003,0.001,0.005,0,0.015,5,0,0.036,0.074,0.097,52.57731959,3,0.04899,0.259032456
25,25,01_02_V3_CLIVAR,1,NA,NA,NA,8,351.2,11/1/01,2001,11,1,00:41,145.643,-43.11667,NA,0.002,0,0,0.002,0.005,0,NA,0.005,0,0.001,0.002,0,0,0,0.002,0.001,0.003,0.001,0,0,0,0,NA,0,0,0.001,0.001,0,0,0,0.002,5,0,0.005,0.012,0.014,71.42857143,3,0.00933,0.302250804
25,25,01_02_V3_CLIVAR,1,NA,NA,NA,12,3.9,11/1/01,2001,11,1,20:35,145.245,-46.66,NA,0.264,0,0.001,0.265,0.167,0,NA,0.167,0,0.039,0.078,0.028,0.031,0,0.043,0.018,0.12,0.018,0,0.05,0.002,0,NA,0.015,0.022,0.008,0.018,0.007,0.052,0,0.085,5,0,0.205,0.45,0.715,25.87412587,3,0.29991,0.202160648
25,25,01_02_V3_CLIVAR,1,NA,NA,NA,12,16.1,11/1/01,2001,11,1,20:35,145.245,-46.66,NA,0.208,0,0,0.208,0.135,0,NA,0.135,0,0.03,0.062,0.022,0.027,0,0.036,0.016,0.101,0.015,0,0.036,0.002,0,NA,0.014,0.019,0.008,0.015,0.005,0.038,0,0.066,5,0,0.167,0.364,0.572,27.27272727,3,0.24528,0.206947162
25,25,01_02_V3_CLIVAR,1,NA,NA,NA,12,30.4,11/1/01,2001,11,1,20:35,145.245,-46.66,NA,0.295,0,0.001,0.296,0.16,0,NA,0.16,0,0.037,0.075,0.025,0.031,0,0.041,0.017,0.114,0.016,0,0.037,0.002,0,NA,0.018,0.023,0.008,0.016,0.005,0.039,0,0.068,5,0,0.182,0.417,0.713,16.97054698,3,0.28407,0.203506178
25,25,01_02_V3_CLIVAR,1,NA,NA,NA,12,45.4,11/1/01,2001,11,1,20:35,145.245,-46.66,NA,0.296,0,0.001,0.297,0.17,0,NA,0.17,0,0.041,0.08,0.031,0.034,0,0.044,0.018,0.127,0.017,0,0.039,0.002,0,NA,0.017,0.022,0.009,0.017,0.005,0.041,0,0.072,5,0,0.199,0.449,0.746,20.37533512,3,0.30937,0.200536574
25,25,01_02_V3_CLIVAR,1,NA,NA,NA,12,61.4,11/1/01,2001,11,1,20:35,145.245,-46.66,NA,0.306,0,0.001,0.307,0.173,0,NA,0.173,0,0.04,0.081,0.029,0.035,0,0.045,0.019,0.128,0.018,0,0.041,0.002,0,NA,0.017,0.023,0.01,0.018,0.006,0.043,0,0.077,5,0,0.205,0.459,0.766,19.84334204,3,0.3128,0.202845269
25,25,01_02_V3_CLIVAR,1,NA,NA,NA,12,75.2,11/1/01,2001,11,1,20:35,145.245,-46.66,NA,0.296,0,0.001,0.297,0.17,0,NA,0.17,0,0.041,0.081,0.032,0.034,0,0.043,0.017,0.126,0.017,0,0.042,0.002,0,NA,0.016,0.022,0.008,0.017,0.006,0.044,0,0.075,5,0,0.201,0.452,0.749,20.69425901,3,0.30877,0.19635975
25,25,01_02_V3_CLIVAR,1,NA,NA,NA,12,90.5,11/1/01,2001,11,1,20:35,145.245,-46.66,NA,0.32,0,0.001,0.321,0.181,0,NA,0.181,0,0.042,0.084,0.033,0.035,0,0.044,0.018,0.13,0.017,0,0.039,0.002,0,NA,0.017,0.023,0.009,0.017,0.006,0.041,0,0.073,5,0,0.203,0.468,0.789,18.63117871,3,0.32365,0.191688552
25,25,01_02_V3_CLIVAR,1,NA,NA,NA,12,105.6,11/1/01,2001,11,1,20:35,145.245,-46.66,NA,0.274,0,0,0.274,0.162,0,NA,0.162,0,0.038,0.076,0.029,0.033,0,0.042,0.017,0.121,0.017,0.001,0.04,0.003,0,NA,0.017,0.023,0.009,0.018,0.006,0.043,0,0.076,5,0,0.197,0.435,0.709,22.70803949,3,0.2953,0.200541822
25,25,01_02_V3_CLIVAR,1,NA,NA,NA,12,120.6,11/1/01,2001,11,1,20:35,145.245,-46.66,NA,0.291,0,0.001,0.292,0.161,0,NA,0.161,0,0.041,0.081,0.028,0.035,0,0.04,0.017,0.12,0.017,0,0.036,0.002,0,NA,0.016,0.021,0.008,0.017,0.005,0.038,0,0.068,5,0,0.188,0.43,0.722,19.11357341,3,0.29016,0.194375517
25,25,01_02_V3_CLIVAR,1,NA,NA,NA,12,151.3,11/1/01,2001,11,1,20:35,145.245,-46.66,NA,0.172,0,0.001,0.173,0.144,0,NA,0.144,0,0.032,0.06,0.015,0.025,0,0.031,0.016,0.087,0.015,0,0.024,0.001,0,NA,0.015,0.019,0.008,0.015,0.004,0.025,0,0.052,5,0,0.139,0.343,0.516,32.94573643,3,0.23675,0.184625132
25,25,01_02_V3_CLIVAR,1,NA,NA,NA,12,200.6,11/1/01,2001,11,1,20:35,145.245,-46.66,NA,0.071,0,0,0.071,0.072,0,NA,0.072,0,0.013,0.023,0.004,0.011,0,0.015,0.007,0.037,0.007,0,0.011,0,0,NA,0.007,0.009,0.004,0.007,0.002,0.011,0,0.024,5,0,0.061,0.156,0.227,37.44493392,3,0.11178,0.18921095
25,25,01_02_V3_CLIVAR,1,NA,NA,NA,18,3.9,11/5/01,2001,11,5,22:58,144.89717,-47.46983,NA,0.289,0,0.002,0.291,0.134,0,NA,0.134,0,0.036,0.08,0.025,0.03,0,0.034,0.01,0.099,0.051,0.002,0.099,0.018,0,NA,0.01,0.015,0.009,0.053,0.005,0.117,0,0.184,5,0,0.283,0.497,0.788,26.14213198,3,0.27829,0.172266341
25,25,01_02_V3_CLIVAR,1,NA,NA,NA,18,15.4,11/5/01,2001,11,5,22:58,144.89717,-47.46983,NA,0.277,0,0.003,0.28,0.147,0,NA,0.147,0,0.039,0.089,0.033,0.035,0,0.04,0.011,0.119,0.056,0.002,0.114,0.013,0,NA,0.011,0.018,0.012,0.058,0.007,0.127,0,0.204,5,0,0.323,0.559,0.839,33.25387366,3,0.31901,0.176796966
25,25,01_02_V3_CLIVAR,1,NA,NA,NA,18,29.8,11/5/01,2001,11,5,22:58,144.89717,-47.46983,NA,0.315,0,0.003,0.318,0.164,0,NA,0.164,0,0.04,0.092,0.034,0.035,0,0.043,0.011,0.123,0.058,0.002,0.11,0.006,0,NA,0.015,0.022,0.01,0.06,0.007,0.116,0,0.193,5,0,0.316,0.572,0.89,28.53932584,3,0.34234,0.177104633
25,25,01_02_V3_CLIVAR,1,NA,NA,NA,18,44.4,11/5/01,2001,11,5,22:58,144.89717,-47.46983,NA,0.357,0,0.002,0.359,0.18,0,NA,0.18,0,0.049,0.112,0.038,0.041,0,0.051,0.016,0.146,0.06,0.001,0.066,0.004,0,NA,0.016,0.024,0.01,0.061,0.008,0.07,0,0.149,5,0,0.295,0.587,0.946,24.10147992,3,0.37924,0.189616074
25,25,01_02_V3_CLIVAR,1,NA,NA,NA,18,60.8,11/5/01,2001,11,5,22:58,144.89717,-47.46983,NA,0.304,0,0.002,0.306,0.182,0,NA,0.182,0,0.054,0.108,0.023,0.037,0,0.059,0.016,0.135,0.038,0.001,0.033,0.002,0,NA,0.019,0.024,0.009,0.039,0.005,0.035,0,0.088,5,0,0.223,0.513,0.819,25.27472527,3,0.35047,0.237366964
25,25,01_02_V3_CLIVAR,1,NA,NA,NA,18,75.2,11/5/01,2001,11,5,22:58,144.89717,-47.46983,NA,0.222,0,0.002,0.224,0.15,0,NA,0.15,0,0.052,0.098,0.015,0.034,0,0.054,0.012,0.115,0.026,0.001,0.023,0.001,0,NA,0.014,0.017,0.009,0.027,0.003,0.024,0,0.063,5,0,0.178,0.426,0.65,31.07692308,3,0.28845,0.263962559
25,25,01_02_V3_CLIVAR,1,NA,NA,NA,18,90.6,11/5/01,2001,11,5,22:58,144.89717,-47.46983,NA,0.178,0,0.001,0.179,0.11,0,NA,0.11,0,0.037,0.067,0.008,0.022,0,0.04,0.008,0.078,0.02,0,0.018,0.001,0,NA,0.008,0.01,0.006,0.02,0.002,0.019,0,0.047,5,0,0.125,0.302,0.481,25.57172557,3,0.20728,0.272095716
25,25,01_02_V3_CLIVAR,1,NA,NA,NA,18,104.2,11/5/01,2001,11,5,22:58,144.89717,-47.46983,NA,0.087,0,0,0.087,0.073,0,NA,0.073,0,0.02,0.035,0.005,0.015,0,0.021,0.008,0.049,0.012,0,0.009,0.001,0,NA,0.006,0.008,0.004,0.012,0.002,0.01,0,0.028,5,0,0.077,0.185,0.272,36.02941176,3,0.12836,0.230679339
25,25,01_02_V3_CLIVAR,1,NA,NA,NA,18,120.7,11/5/01,2001,11,5,22:58,144.89717,-47.46983,NA,0.058,0,0,0.058,0.055,0,NA,0.055,0,0.014,0.024,0.003,0.011,0,0.015,0.007,0.036,0.007,0,0.008,0,0,NA,0.007,0.008,0.003,0.007,0.001,0.008,0,0.019,5,0,0.055,0.134,0.192,39.58333333,3,0.0926,0.228401728
25,25,01_02_V3_CLIVAR,1,NA,NA,NA,18,151.5,11/5/01,2001,11,5,22:58,144.89717,-47.46983,NA,0.024,0,0,0.024,0.022,0,NA,0.022,0,0.008,0.013,0.003,0.006,0,0.007,0.003,0.019,0.004,0,0.004,0,0,NA,0.002,0.002,0.002,0.004,0,0.004,0,0.01,5,0,0.029,0.064,0.088,45.45454545,3,0.04306,0.229215049
25,25,01_02_V3_CLIVAR,1,NA,NA,NA,18,250.3,11/5/01,2001,11,5,22:58,144.89717,-47.46983,NA,0.003,0,0,0.003,0.004,0,NA,0.004,0,0.002,0.003,0,0.002,0,0.002,0.001,0.005,0.001,0,0.001,0,0,NA,0,0,0.001,0.001,0,0.001,0,0.003,5,0,0.008,0.015,0.018,66.66666667,3,0.00902,0.312638581
25,25,01_02_V3_CLIVAR,1,NA,NA,NA,22,5.7,11/6/01,2001,11,6,18:28,144.54667,-48.32833,NA,0.35,0,0.004,0.354,0.098,0,NA,0.098,0,0.051,0.109,0.04,0.048,0,0.043,0.01,0.141,0.019,0,0.111,0.007,0,NA,0.009,0.015,0.008,0.019,0.006,0.118,0,0.151,5,0,0.292,0.499,0.853,16.99882767,3,0.25395,0.238747785
25,25,01_02_V3_CLIVAR,1,NA,NA,NA,22,14.7,11/6/01,2001,11,6,18:28,144.54667,-48.32833,NA,0.327,0,0.003,0.33,0.098,0,NA,0.098,0,0.051,0.11,0.042,0.049,0,0.043,0.009,0.143,0.018,0,0.106,0.008,0,NA,0.008,0.014,0.011,0.018,0.006,0.114,0,0.149,5,0,0.292,0.5,0.83,20.48192771,3,0.25806,0.234945362
25,25,01_02_V3_CLIVAR,1,NA,NA,NA,22,30.7,11/6/01,2001,11,6,18:28,144.54667,-48.32833,NA,0.348,0,0.004,0.352,0.11,0,NA,0.11,0,0.056,0.122,0.043,0.052,0,0.048,0.012,0.155,0.02,0.001,0.096,0.007,0,NA,0.014,0.021,0.012,0.021,0.007,0.103,0,0.143,5,0,0.298,0.53,0.882,20.1814059,3,0.28201,0.23999149
25,25,01_02_V3_CLIVAR,2,NA,NA,NA,22,30.7,11/6/01,2001,11,6,18:28,144.54667,-48.32833,NA,0.273,0,0.004,0.277,0.231,0,NA,0.231,0,0.054,0.096,0.018,0.042,0,0.049,0.02,0.129,0.02,0,0.035,0.002,0,NA,0.027,0.032,0.006,0.02,0.005,0.037,0,0.068,5,0,0.197,0.524,0.801,30.83645443,3,0.36328,0.19018388
25,25,01_02_V3_CLIVAR,1,NA,NA,NA,22,46,11/6/01,2001,11,6,18:28,144.54667,-48.32833,NA,0.313,0,0.002,0.315,0.165,0,NA,0.165,0,0.053,0.104,0.024,0.043,0,0.046,0.015,0.128,0.017,0,0.046,0.005,0,NA,0.018,0.023,0.008,0.017,0.005,0.051,0,0.081,5,0,0.209,0.478,0.793,20.55485498,3,0.29982,0.216329798
25,25,01_02_V3_CLIVAR,1,NA,NA,NA,22,75,11/6/01,2001,11,6,18:28,144.54667,-48.32833,NA,0.227,0,0.002,0.229,0.203,0,NA,0.203,0,0.045,0.077,0.011,0.035,0,0.039,0.018,0.103,0.016,0,0.025,0.001,0,NA,0.024,0.028,0.002,0.016,0.004,0.026,0,0.048,5,0,0.151,0.431,0.66,30.60606061,3,0.30274,0.181641012
25,25,01_02_V3_CLIVAR,1,NA,NA,NA,22,90,11/6/01,2001,11,6,18:28,144.54667,-48.32833,NA,0.156,0,0.001,0.157,0.212,0,NA,0.212,0,0.034,0.056,0.006,0.027,0,0.03,0.02,0.083,0.014,0,0.015,0,0,NA,0.021,0.025,0.002,0.014,0.004,0.015,0,0.035,5,0,0.118,0.386,0.543,42.17311234,3,0.28757,0.14709462
25,25,01_02_V3_CLIVAR,1,NA,NA,NA,22,104.4,11/6/01,2001,11,6,18:28,144.54667,-48.32833,NA,0.121,0,0.001,0.122,0.181,0,NA,0.181,0,0.023,0.037,0.006,0.025,0,0.022,0.019,0.072,0.012,0,0.012,0.001,0,NA,0.02,0.023,0.002,0.012,0.003,0.013,0,0.03,5,0,0.102,0.32,0.442,44.79638009,3,0.24256,0.127885884
25,25,01_02_V3_CLIVAR,1,NA,NA,NA,22,121,11/6/01,2001,11,6,18:28,144.54667,-48.32833,NA,0.099,0,0.001,0.1,0.128,0,NA,0.128,0,0.02,0.032,0.005,0.02,0,0.017,0.012,0.054,0.008,0,0.009,0,0,NA,0.013,0.015,0.002,0.008,0.002,0.009,0,0.021,5,0,0.075,0.235,0.335,40.29850746,3,0.17538,0.136674649
25,25,01_02_V3_CLIVAR,1,NA,NA,NA,22,149.6,11/6/01,2001,11,6,18:28,144.54667,-48.32833,NA,0.037,0,0,0.037,0.051,0,NA,0.051,0,0.009,0.015,0.003,0.009,0,0.006,0.005,0.023,0.004,0,0.005,0,0,NA,0.005,0.006,0.001,0.004,0.001,0.005,0,0.011,5,0,0.034,0.1,0.137,45.98540146,3,0.07139,0.118503992
25,25,01_02_V3_CLIVAR,1,NA,NA,NA,22,250.6,11/6/01,2001,11,6,18:28,144.54667,-48.32833,NA,0.012,0,0,0.012,0.011,0,NA,0.011,0,0.003,0.006,0,0.005,0,0.001,0,0.006,0.001,0,0.003,0,0,NA,0,0,0.001,0.001,0,0.003,0,0.005,5,0,0.011,0.028,0.04,40,3,0.01573,0.089637635
25,25,01_02_V3_CLIVAR,1,NA,NA,NA,22,351.8,11/6/01,2001,11,6,18:28,144.54667,-48.32833,NA,0.01,0,0,0.01,0.012,0,NA,0.012,0,0.003,0.005,0.002,0.005,0,0.003,0.002,0.012,0.002,0,0.004,0.001,0,NA,0,0,0.001,0.002,0,0.005,0,0.008,5,0,0.02,0.037,0.047,57.44680851,3,0.02324,0.182013769
25,25,01_02_V3_CLIVAR,1,NA,NA,NA,25,4.6,11/7/01,2001,11,7,09:18,144.50617,-48.79875,NA,0.261,0,0.003,0.264,0.158,0,NA,0.158,0,0.028,0.063,0.022,0.027,0,0.033,0.02,0.102,0.024,0.001,0.08,0.005,0,NA,0.019,0.03,0.012,0.025,0.011,0.085,0,0.133,5,0,0.235,0.456,0.72,26.66666667,3,0.27442,0.169557612
25,25,01_02_V3_CLIVAR,1,NA,NA,NA,25,14.7,11/7/01,2001,11,7,09:18,144.50617,-48.79875,NA,0.297,0,0,0.297,0.178,0,NA,0.178,0,0.034,0.074,0.026,0.032,0,0.038,0.02,0.116,0.026,0.001,0.094,0.006,0,NA,0.016,0.027,0.013,0.027,0.011,0.1,0,0.151,5,0,0.267,0.519,0.816,27.20588235,3,0.31138,0.172072709
25,25,01_02_V3_CLIVAR,1,NA,NA,NA,25,24.7,11/7/01,2001,11,7,09:18,144.50617,-48.79875,NA,0.137,0,0,0.137,0.115,0,NA,0.115,0,0.021,0.046,0.014,0.022,0,0.024,0.012,0.072,0.014,0,0.039,0.003,0,NA,0.009,0.014,0.006,0.014,0.005,0.042,0,0.067,5,0,0.139,0.3,0.437,37.29977117,3,0.19307,0.175273217
25,25,01_02_V3_CLIVAR,1,NA,NA,NA,25,53,11/7/01,2001,11,7,09:18,144.50617,-48.79875,NA,0.282,0,0,0.282,0.208,0,NA,0.208,0,0.032,0.071,0.015,0.031,0,0.041,0.022,0.109,0.024,0,0.046,0.002,0,NA,0.021,0.029,0.012,0.024,0.008,0.048,0,0.092,5,0,0.201,0.48,0.762,25.98425197,3,0.32773,0.176395203
25,25,01_02_V3_CLIVAR,1,NA,NA,NA,25,70.3,11/7/01,2001,11,7,09:18,144.50617,-48.79875,NA,0.22,0,0.002,0.222,0.209,0,NA,0.209,0,0.037,0.072,0.008,0.029,0,0.039,0.021,0.097,0.018,0,0.028,0.001,0,NA,0.02,0.025,0.01,0.018,0.005,0.029,0,0.062,5,0,0.159,0.44,0.662,32.9305136,3,0.30899,0.177966924
25,25,01_02_V3_CLIVAR,1,NA,NA,NA,25,89.5,11/7/01,2001,11,7,09:18,144.50617,-48.79875,NA,0.142,0,0.001,0.143,0.174,0,NA,0.174,0,0.028,0.051,0,0.02,0,0.03,0.02,0.07,0.014,0,0.019,0,0,NA,0.022,0.026,0.006,0.014,0.004,0.019,0,0.043,5,0,0.113,0.338,0.481,40.54054054,3,0.24068,0.175752036
25,25,01_02_V3_CLIVAR,1,NA,NA,NA,25,99.5,11/7/01,2001,11,7,09:18,144.50617,-48.79875,NA,0.139,0,0.001,0.14,0.164,0,NA,0.164,0,0.024,0.043,0.002,0.019,0,0.027,0.018,0.066,0.011,0,0.014,0.001,0,NA,0.017,0.021,0.005,0.011,0.004,0.015,0,0.035,5,0,0.101,0.308,0.448,37.5,3,0.22564,0.168720085
25,25,01_02_V3_CLIVAR,1,NA,NA,NA,25,150.6,11/7/01,2001,11,7,09:18,144.50617,-48.79875,NA,0.009,0,0,0.009,0.015,0,NA,0.015,0,0.003,0.005,0,0.003,0,0.001,0.002,0.006,0.001,0,0.003,0,0,NA,0.001,0.001,0.001,0.001,0,0.003,0,0.005,5,0,0.011,0.031,0.04,55,3,0.01907,0.073938123
25,25,01_02_V3_CLIVAR,1,NA,NA,NA,25,200.4,11/7/01,2001,11,7,09:18,144.50617,-48.79875,NA,0.01,0,0,0.01,0.014,0,NA,0.014,0,0.003,0.006,0.001,0.004,0,0.003,0.002,0.01,0.001,0,0.002,0,0,NA,0,0,0.001,0.001,0,0.002,0,0.004,5,0,0.014,0.034,0.044,54.54545455,3,0.02264,0.186837456
25,25,01_02_V3_CLIVAR,1,NA,NA,NA,26,10.4,11/7/01,2001,11,7,16:12,144.10817,-49.272,NA,0.05,0,0,0.05,0.05,0,NA,0.05,0,0.006,0.015,0.012,0.008,0,0.01,0.007,0.037,0.015,0.001,0.025,0.002,0,NA,0.005,0.009,0.005,0.016,0.004,0.027,0,0.052,5,0,0.089,0.154,0.204,50.98039216,3,0.10022,0.140690481
25,25,01_02_V3_CLIVAR,1,NA,NA,NA,26,41.5,11/7/01,2001,11,7,16:12,144.10817,-49.272,NA,0.068,0,0,0.068,0.07,0,NA,0.07,0,0.008,0.021,0.008,0.011,0,0.008,0.011,0.038,0.021,0,0.021,0.002,0,NA,0.009,0.015,0.004,0.021,0.006,0.023,0,0.054,5,0,0.092,0.183,0.251,45.81673307,3,0.11757,0.095942843
25,25,01_02_V3_CLIVAR,1,NA,NA,NA,26,81.1,11/7/01,2001,11,7,16:12,144.10817,-49.272,NA,0.127,0,0,0.127,0.104,0,NA,0.104,0,0.025,0.051,0.014,0.025,0,0.015,0.013,0.067,0.02,0,0.022,0.002,0,NA,0.014,0.02,0.005,0.02,0.006,0.024,0,0.055,5,0,0.122,0.277,0.404,37.12871287,3,0.17488,0.120940073
25,25,01_02_V3_CLIVAR,1,NA,NA,NA,26,120.6,11/7/01,2001,11,7,16:12,144.10817,-49.272,NA,0.137,0,0,0.137,0.171,0,NA,0.171,0,0.026,0.047,0.01,0.02,0,0.012,0.015,0.057,0.015,0.001,0.011,0.002,0,NA,0.017,0.021,0.005,0.016,0.004,0.013,0,0.038,5,0,0.095,0.313,0.45,39.11111111,3,0.22663,0.074659136
25,25,01_02_V3_CLIVAR,1,NA,NA,NA,26,160.9,11/7/01,2001,11,7,16:12,144.10817,-49.272,NA,0.125,0,0,0.125,0.208,0,NA,0.208,0,0.027,0.043,0.002,0.022,0,0.011,0.017,0.052,0.005,0.001,0.007,0.001,0,NA,0.02,0.023,0.005,0.006,0.003,0.008,0,0.022,5,0,0.074,0.325,0.45,44.44444444,3,0.24341,0.06371965
25,25,01_02_V3_CLIVAR,1,NA,NA,NA,26,201.3,11/7/01,2001,11,7,16:12,144.10817,-49.272,NA,0.033,0,0,0.033,0.056,0,NA,0.056,0,0.008,0.015,0,0.007,0,0.005,0.005,0.017,0.001,0,0.005,0,0,NA,0.007,0.008,0.003,0.001,0.001,0.005,0,0.01,5,0,0.027,0.098,0.131,49.61832061,3,0.06872,0.102590221
25,25,01_02_V3_CLIVAR,1,NA,NA,NA,27,5.5,11/7/01,2001,11,7,20:01,143.93783,-49.61133,NA,0.062,0,0,0.062,0.048,0,NA,0.048,0,0.009,0.02,0.009,0.008,0,0.008,0.007,0.032,0.016,0.001,0.034,0.002,0,NA,0.005,0.009,0.003,0.017,0.004,0.036,0,0.06,5,0,0.092,0.16,0.222,44.14414414,3,0.09081,0.124215395
25,25,01_02_V3_CLIVAR,1,NA,NA,NA,27,14.9,11/7/01,2001,11,7,20:01,143.93783,-49.61133,NA,0.062,0,0,0.062,0.049,0,NA,0.049,0,0.008,0.018,0.009,0.009,0,0.009,0.007,0.034,0.018,0.001,0.035,0.003,0,NA,0.004,0.008,0.003,0.019,0.004,0.038,0,0.064,5,0,0.098,0.165,0.227,45.37444934,3,0.0953,0.133158447
25,25,01_02_V3_CLIVAR,1,NA,NA,NA,27,32.6,11/7/01,2001,11,7,20:01,143.93783,-49.61133,NA,0.064,0,0,0.064,0.077,0,NA,0.077,0,0.011,0.022,0.005,0.011,0,0.007,0.009,0.032,0.015,0.001,0.018,0.001,0,NA,0.006,0.01,0.004,0.016,0.004,0.019,0,0.043,5,0,0.075,0.174,0.238,46.21848739,3,0.11384,0.086700632
25,25,01_02_V3_CLIVAR,1,NA,NA,NA,27,46.1,11/7/01,2001,11,7,20:01,143.93783,-49.61133,NA,0.082,0,0,0.082,0.078,0,NA,0.078,0,0.017,0.035,0.009,0.015,0,0.01,0.012,0.046,0.023,0.001,0.026,0.002,0,NA,0.01,0.017,0.003,0.024,0.007,0.028,0,0.062,5,0,0.108,0.221,0.303,45.87458746,3,0.1324,0.106495468
25,25,01_02_V3_CLIVAR,1,NA,NA,NA,27,60.1,11/7/01,2001,11,7,20:01,143.93783,-49.61133,NA,0.107,0,0,0.107,0.093,0,NA,0.093,0,0.02,0.042,0.009,0.021,0,0.012,0.01,0.052,0.023,0.001,0.023,0.002,0,NA,0.009,0.014,0.004,0.024,0.005,0.025,0,0.058,5,0,0.11,0.245,0.352,39.20454545,3,0.15307,0.110537663
25,25,01_02_V3_CLIVAR,1,NA,NA,NA,27,79,11/7/01,2001,11,7,20:01,143.93783,-49.61133,NA,0.113,0,0,0.113,0.156,0,NA,0.156,0,0.022,0.041,0.007,0.02,0,0.01,0.015,0.052,0.017,0.001,0.013,0.002,0,NA,0.017,0.023,0.006,0.018,0.006,0.015,0,0.045,5,0,0.097,0.294,0.407,44.47174447,3,0.20675,0.068198307
25,25,01_02_V3_CLIVAR,1,NA,NA,NA,27,93.3,11/7/01,2001,11,7,20:01,143.93783,-49.61133,NA,0.138,0,0,0.138,0.186,0,NA,0.186,0,0.023,0.041,0.004,0.019,0,0.01,0.016,0.049,0.012,0.001,0.011,0.001,0,NA,0.018,0.023,0.006,0.013,0.005,0.012,0,0.036,5,0,0.085,0.312,0.45,38.66666667,3,0.22817,0.061796029
25,25,01_02_V3_CLIVAR,1,NA,NA,NA,27,105.3,11/7/01,2001,11,7,20:01,143.93783,-49.61133,NA,0.106,0,0,0.106,0.18,0,NA,0.18,0,0.021,0.039,0.003,0.018,0,0.009,0.016,0.046,0.01,0.001,0.009,0.001,0,NA,0.016,0.02,0.007,0.011,0.004,0.01,0,0.032,5,0,0.078,0.297,0.403,47.39454094,3,0.21782,0.058259113
25,25,01_02_V3_CLIVAR,1,NA,NA,NA,27,119.4,11/7/01,2001,11,7,20:01,143.93783,-49.61133,NA,0.124,0,0,0.124,0.186,0,NA,0.186,0,0.026,0.046,0.007,0.018,0,0.011,0.016,0.052,0.012,0.001,0.01,0.001,0,NA,0.018,0.022,0.006,0.013,0.004,0.011,0,0.034,5,0,0.086,0.318,0.442,43.89140271,3,0.23346,0.066435364
25,25,01_02_V3_CLIVAR,1,NA,NA,NA,27,150.4,11/7/01,2001,11,7,20:01,143.93783,-49.61133,NA,0.048,0,0,0.048,0.073,0,NA,0.073,0,0.011,0.018,0.001,0.009,0,0.005,0.006,0.021,0.003,0.001,0.005,0,0,NA,0.006,0.007,0.003,0.004,0.001,0.005,0,0.013,5,0,0.034,0.125,0.173,44.50867052,3,0.08972,0.078577798
25,25,01_02_V3_CLIVAR,1,NA,NA,NA,27,251,11/7/01,2001,11,7,20:01,143.93783,-49.61133,NA,0.005,0,0,0.005,0.008,0,NA,0.008,0,0.002,0.003,0.001,0.002,0,0.001,0.001,0.005,0.001,0,0.001,0,0,NA,0,0,0.001,0.001,0,0.001,0,0.003,5,0,0.008,0.019,0.024,58.33333333,3,0.01306,0.107963247
25,25,01_02_V3_CLIVAR,1,NA,NA,NA,27,351.6,11/7/01,2001,11,7,20:01,143.93783,-49.61133,NA,0.007,0,0,0.007,0.007,0,NA,0.007,0,0.003,0.005,0,0.003,0,0.003,0.001,0.007,0.001,0,0.004,0,0,NA,0,0.001,0.001,0.001,0.001,0.004,0,0.007,5,0,0.014,0.026,0.033,57.57575758,3,0.01381,0.306299783
25,25,01_02_V3_CLIVAR,1,NA,NA,NA,29,9.2,11/8/01,2001,11,8,04:39,143.84667,-49.896,NA,0.069,0,0,0.069,0.062,0,NA,0.062,0,0.012,0.027,0.01,0.012,0,0.01,0.007,0.039,0.01,0.002,0.049,0.004,0,NA,0.006,0.01,0.004,0.012,0.004,0.053,0,0.073,5,0,0.112,0.201,0.27,48.88888889,3,0.10602,0.132993775
25,25,01_02_V3_CLIVAR,1,NA,NA,NA,29,50.1,11/8/01,2001,11,8,04:39,143.84667,-49.896,NA,0.08,0,0,0.08,0.084,0,NA,0.084,0,0.016,0.037,0.005,0.015,0,0.011,0.011,0.042,0.013,0.001,0.04,0.003,0,NA,0.01,0.018,0.003,0.014,0.008,0.043,0,0.068,5,0,0.11,0.231,0.311,48.55305466,3,0.12563,0.123457773
25,25,01_02_V3_CLIVAR,1,NA,NA,NA,29,101.9,11/8/01,2001,11,8,04:39,143.84667,-49.896,NA,0.156,0,0,0.156,0.226,0,NA,0.226,0,0.037,0.069,0.008,0.03,0,0.018,0.023,0.079,0.008,0.001,0.018,0.002,0,NA,0.025,0.032,0.006,0.009,0.007,0.02,0,0.042,5,0,0.121,0.416,0.572,45.45454545,3,0.2859,0.088772298
25,25,01_02_V3_CLIVAR,1,NA,NA,NA,29,199.6,11/8/01,2001,11,8,04:39,143.84667,-49.896,NA,0.026,0,0,0.026,0.041,0,NA,0.041,0,0.01,0.017,0.002,0.007,0,0.006,0.004,0.019,0.001,0,0.005,0,0,NA,0.004,0.005,0.002,0.001,0.001,0.005,0,0.009,5,0,0.028,0.086,0.112,53.57142857,3,0.0572,0.147902098
25,25,01_02_V3_CLIVAR,1,NA,NA,NA,31,5.8,11/8/01,2001,11,8,23:55,143.5265,-50.40117,NA,0.07,0,0,0.07,0.046,0,NA,0.046,0,0.01,0.022,0.003,0.01,0,0.009,0.004,0.026,0.021,0.002,0.035,0.005,0,NA,0.004,0.007,0.003,0.023,0.003,0.04,0,0.069,5,0,0.095,0.163,0.233,39.91416309,3,0.08674,0.146299285
25,25,01_02_V3_CLIVAR,1,NA,NA,NA,31,15.4,11/8/01,2001,11,8,23:55,143.5265,-50.40117,NA,0.072,0,0,0.072,0.045,0,NA,0.045,0,0.008,0.019,0.008,0.008,0,0.01,0.005,0.031,0.022,0.001,0.036,0.004,0,NA,0.006,0.01,0.004,0.023,0.004,0.04,0,0.071,5,0,0.102,0.166,0.238,39.49579832,3,0.09495,0.14849921
25,25,01_02_V3_CLIVAR,1,NA,NA,NA,31,29.6,11/8/01,2001,11,8,23:55,143.5265,-50.40117,NA,0.073,0,0,0.073,0.046,0,NA,0.046,0,0.009,0.02,0,0.012,0,0.011,0.006,0.029,0.021,0.001,0.038,0.003,0,NA,0.008,0.012,0.003,0.022,0.004,0.041,0,0.07,5,0,0.099,0.165,0.238,38.65546218,3,0.08603,0.180285947
25,25,01_02_V3_CLIVAR,1,NA,NA,NA,31,46.3,11/8/01,2001,11,8,23:55,143.5265,-50.40117,NA,0.074,0,0,0.074,0.049,0,NA,0.049,0,0.01,0.024,0,0.01,0,0.012,0.008,0.03,0.022,0.001,0.036,0.002,0,NA,0.006,0.011,0.004,0.023,0.005,0.038,0,0.07,5,0,0.1,0.173,0.247,40.08097166,3,0.09123,0.185465307
25,25,01_02_V3_CLIVAR,1,NA,NA,NA,31,58.2,11/8/01,2001,11,8,23:55,143.5265,-50.40117,NA,0.083,0,0,0.083,0.066,0,NA,0.066,0,0.013,0.031,0.01,0.006,0,0.02,0,0.036,0.026,0,0.036,0,0,NA,0.009,0.015,0,0.026,0.006,0.036,0,0.068,5,0,0.104,0.201,0.284,41.54929577,3,0.13342,0.211362614
25,25,01_02_V3_CLIVAR,1,NA,NA,NA,31,81.4,11/8/01,2001,11,8,23:55,143.5265,-50.40117,NA,0.169,0,0,0.169,0.21,0,NA,0.21,0,0.028,0.055,0.016,0.032,0,0.015,0.017,0.08,0.017,0.002,0.018,0.002,0,NA,0.021,0.027,0.006,0.019,0.006,0.02,0,0.051,5,0,0.131,0.396,0.565,40.17699115,3,0.28523,0.074150685
25,25,01_02_V3_CLIVAR,1,NA,NA,NA,31,90.2,11/8/01,2001,11,8,23:55,143.5265,-50.40117,NA,0.166,0,0,0.166,0.219,0,NA,0.219,0,0.029,0.052,0.011,0.029,0,0.014,0.019,0.073,0.012,0.002,0.013,0.001,0,NA,0.02,0.025,0.005,0.014,0.005,0.014,0,0.038,5,0,0.111,0.382,0.548,39.41605839,3,0.27991,0.070522668
25,25,01_02_V3_CLIVAR,1,NA,NA,NA,31,105.3,11/8/01,2001,11,8,23:55,143.5265,-50.40117,NA,0.124,0,0,0.124,0.186,0,NA,0.186,0,0.022,0.038,0.003,0.024,0,0.009,0.015,0.051,0.004,0.002,0.008,0,0,NA,0.015,0.019,0.004,0.006,0.004,0.008,0,0.022,5,0,0.073,0.297,0.421,41.09263658,3,0.21902,0.057939914
25,25,01_02_V3_CLIVAR,1,NA,NA,NA,31,121.2,11/8/01,2001,11,8,23:55,143.5265,-50.40117,NA,0.073,0,0,0.073,0.104,0,NA,0.104,0,0.017,0.03,0.001,0.017,0,0.008,0.008,0.034,0.002,0.001,0.006,0,0,NA,0.01,0.012,0.005,0.003,0.002,0.006,0,0.016,5,0,0.05,0.184,0.257,43.19066148,3,0.1284,0.087850467
25,25,01_02_V3_CLIVAR,1,NA,NA,NA,31,150.6,11/8/01,2001,11,8,23:55,143.5265,-50.40117,NA,0.04,0,0,0.04,0.057,0,NA,0.057,0,0.011,0.019,0.002,0.009,0,0.005,0.006,0.022,0.002,0.001,0.004,0,0,NA,0.006,0.007,0.004,0.003,0.001,0.004,0,0.012,5,0,0.034,0.11,0.15,46.66666667,3,0.07471,0.094364878
25,25,01_02_V3_CLIVAR,1,NA,NA,NA,31,199.4,11/8/01,2001,11,8,23:55,143.5265,-50.40117,NA,0.018,0,0,0.018,0.028,0,NA,0.028,0,0.004,0.007,0.001,0.004,0,0.004,0.002,0.011,0.001,0.001,0.002,0,0,NA,0.002,0.002,0.001,0.002,0,0.002,0,0.005,5,0,0.016,0.051,0.069,47.82608696,3,0.03819,0.147682639
25,25,01_02_V3_CLIVAR,1,NA,NA,NA,36,5.2,11/9/01,2001,11,9,20:43,143.30917,-51.0245,NA,0.077,0,0,0.077,0.067,0,NA,0.067,0,0.01,0.024,0.011,0.011,0,0.01,0.009,0.041,0.015,0.001,0.041,0.005,0,NA,0.006,0.011,0.006,0.016,0.005,0.046,0,0.073,5,0,0.114,0.205,0.282,45.39007092,3,0.11763,0.119867381
25,25,01_02_V3_CLIVAR,1,NA,NA,NA,36,16.1,11/9/01,2001,11,9,20:43,143.30917,-51.0245,NA,0.081,0,0,0.081,0.063,0,NA,0.063,0,0.01,0.024,0.002,0.011,0,0.008,0.008,0.029,0.014,0.001,0.041,0.003,0,NA,0.008,0.012,0.005,0.015,0.004,0.044,0,0.068,5,0,0.097,0.184,0.265,38.86792453,3,0.09662,0.116746015
25,25,01_02_V3_CLIVAR,1,NA,NA,NA,36,25.5,11/9/01,2001,11,9,20:43,143.30917,-51.0245,NA,0.087,0,0,0.087,0.067,0,NA,0.067,0,0.01,0.026,0.008,0.012,0,0.009,0.009,0.038,0.015,0.001,0.043,0.002,0,NA,0.009,0.014,0.005,0.016,0.005,0.045,0,0.071,5,0,0.109,0.202,0.289,39.79238754,3,0.11174,0.11356721
25,25,01_02_V3_CLIVAR,1,NA,NA,NA,36,51,11/9/01,2001,11,9,20:43,143.30917,-51.0245,NA,0.108,0,0,0.108,0.089,0,NA,0.089,0,0.015,0.034,0.011,0.014,0,0.011,0.011,0.047,0.018,0.001,0.033,0.002,0,NA,0.01,0.016,0.005,0.019,0.006,0.035,0,0.065,5,0,0.112,0.235,0.343,37.02623907,3,0.14429,0.107491857
25,25,01_02_V3_CLIVAR,1,NA,NA,NA,36,75.1,11/9/01,2001,11,9,20:43,143.30917,-51.0245,NA,0.193,0,0,0.193,0.22,0,NA,0.22,0,0.033,0.063,0.015,0.028,0,0.02,0.02,0.083,0.013,0.001,0.02,0.002,0,NA,0.02,0.026,0.009,0.014,0.006,0.022,0,0.051,5,0,0.134,0.417,0.61,36.72131148,3,0.29793,0.094653106
25,25,01_02_V3_CLIVAR,1,NA,NA,NA,36,91.5,11/9/01,2001,11,9,20:43,143.30917,-51.0245,NA,0.23,0,0,0.23,0.263,0,NA,0.263,0,0.037,0.063,0.01,0.028,0,0.023,0.022,0.083,0.008,0.001,0.015,0.001,0,NA,0.023,0.028,0.007,0.009,0.005,0.016,0,0.037,5,0,0.12,0.446,0.676,31.95266272,3,0.33304,0.097375691
25,25,01_02_V3_CLIVAR,1,NA,NA,NA,36,101.4,11/9/01,2001,11,9,20:43,143.30917,-51.0245,NA,0.189,0,0,0.189,0.271,0,NA,0.271,0,0.034,0.057,0.005,0.027,0,0.02,0.025,0.077,0.006,0.001,0.015,0.001,0,NA,0.023,0.029,0.007,0.007,0.006,0.016,0,0.036,5,0,0.113,0.441,0.63,40,3,0.32777,0.08603594
25,25,01_02_V3_CLIVAR,1,NA,NA,NA,36,126.9,11/9/01,2001,11,9,20:43,143.30917,-51.0245,NA,0.086,0,0,0.086,0.114,0,NA,0.114,0,0.019,0.03,0.004,0.016,0,0.009,0.01,0.039,0.002,0.001,0.008,0,0,NA,0.01,0.012,0.004,0.003,0.002,0.008,0,0.017,5,0,0.056,0.2,0.286,39.86013986,3,0.14319,0.088623507
25,25,01_02_V3_CLIVAR,1,NA,NA,NA,38,5.3,11/10/01,2001,11,10,04:53,143.42933,-51.00433,NA,0,0,0,0,0.001,0,NA,0.001,0,0,0,0,0,0,0.001,0,0.001,0,0,0,0,0,NA,0,0,0.001,0,0,0,0,0.001,5,0,0.002,0.003,0.003,100,3,0.00302,0.466887417
25,25,01_02_V3_CLIVAR,1,NA,NA,NA,38,20.4,11/10/01,2001,11,10,04:53,143.42933,-51.00433,NA,0.09,0,0,0.09,0.053,0,NA,0.053,0,0.012,0.026,0.009,0.011,0,0.007,0.006,0.033,0.017,0.002,0.048,0.006,0,NA,0.006,0.008,0.007,0.019,0.002,0.054,0,0.082,5,0,0.115,0.194,0.284,36.61971831,3,0.09876,0.099939247
25,25,01_02_V3_CLIVAR,1,NA,NA,NA,38,40.2,11/10/01,2001,11,10,04:53,143.42933,-51.00433,NA,0.102,0,0,0.102,0.063,0,NA,0.063,0,0.013,0.029,0.002,0.012,0,0.01,0.009,0.033,0.018,0.001,0.046,0.004,0,NA,0.008,0.013,0.008,0.019,0.005,0.05,0,0.082,5,0,0.115,0.207,0.309,33.98058252,3,0.10503,0.134247358
25,25,01_02_V3_CLIVAR,1,NA,NA,NA,38,58.8,11/10/01,2001,11,10,04:53,143.42933,-51.00433,NA,0.116,0,0.001,0.117,0.086,0,NA,0.086,0,0.015,0.036,0.01,0.015,0,0.011,0.01,0.046,0.021,0.001,0.038,0.003,0,NA,0.008,0.014,0.006,0.022,0.006,0.041,0,0.075,5,0,0.121,0.243,0.36,35,3,0.14338,0.108174083
25,25,01_02_V3_CLIVAR,1,NA,NA,NA,38,80.8,11/10/01,2001,11,10,04:53,143.42933,-51.00433,NA,0.202,0,0,0.202,0.207,0,NA,0.207,0,0.027,0.056,0.023,0.026,0,0.015,0.019,0.083,0.018,0.001,0.031,0.003,0,NA,0.021,0.029,0.007,0.019,0.008,0.034,0,0.068,5,0,0.151,0.414,0.616,34.41558442,3,0.29143,0.072573174
25,25,01_02_V3_CLIVAR,1,NA,NA,NA,38,101.2,11/10/01,2001,11,10,04:53,143.42933,-51.00433,NA,0.195,0,0,0.195,0.244,0,NA,0.244,0,0.029,0.052,0.009,0.023,0,0.016,0.021,0.069,0.009,0.001,0.016,0.001,0,NA,0.022,0.028,0.007,0.01,0.006,0.017,0,0.04,5,0,0.109,0.405,0.6,35,3,0.30168,0.074781225
25,25,01_02_V3_CLIVAR,1,NA,NA,NA,38,124.9,11/10/01,2001,11,10,04:53,143.42933,-51.00433,NA,0.145,0,0,0.145,0.193,0,NA,0.193,0,0.027,0.045,0.006,0.022,0,0.016,0.017,0.061,0.005,0.001,0.01,0.001,0,NA,0.018,0.022,0.007,0.006,0.004,0.011,0,0.028,5,0,0.089,0.327,0.472,38.55932203,3,0.24215,0.093165393
25,25,01_02_V3_CLIVAR,1,NA,NA,NA,38,151.2,11/10/01,2001,11,10,04:53,143.42933,-51.00433,NA,0.051,0,0,0.051,0.073,0,NA,0.073,0,0.011,0.018,0.002,0.01,0,0.005,0.006,0.023,0.002,0.001,0.005,0,0,NA,0.007,0.009,0.004,0.003,0.002,0.005,0,0.014,5,0,0.037,0.128,0.179,43.01675978,3,0.09122,0.077285683
25,25,01_02_V3_CLIVAR,1,NA,NA,NA,38,173.7,11/10/01,2001,11,10,04:53,143.42933,-51.00433,NA,0.035,0,0,0.035,0.054,0,NA,0.054,0,0.008,0.013,0.003,0.007,0,0.004,0.006,0.02,0.001,0,0.005,0,0,NA,0.007,0.008,0.003,0.001,0.001,0.005,0,0.01,5,0,0.03,0.097,0.132,46.96969697,3,0.06952,0.081127733
25,25,01_02_V3_CLIVAR,1,NA,NA,NA,38,200.3,11/10/01,2001,11,10,04:53,143.42933,-51.00433,NA,0.016,0,0,0.016,0.032,0,NA,0.032,0,0.006,0.01,0,0.007,0,0.004,0.003,0.014,0.001,0,0.003,0,0,NA,0.005,0.006,0.001,0.001,0.001,0.003,0,0.006,5,0,0.02,0.062,0.078,58.97435897,3,0.04187,0.134702651
25,25,01_02_V3_CLIVAR,1,NA,NA,NA,39,51.2,11/10/01,2001,11,10,09:39,143.1565,-51.24983,NA,0.136,0,0.001,0.137,0.082,0,NA,0.082,0,0.019,0.045,0.009,0.021,0,0.024,0.012,0.066,0.007,0.001,0.052,0.002,0,NA,0.012,0.019,0.003,0.008,0.007,0.054,0,0.072,5,0,0.138,0.265,0.402,31.84079602,3,0.14452,0.234154442
25,25,01_02_V3_CLIVAR,1,NA,NA,NA,39,99.8,11/10/01,2001,11,10,09:39,143.1565,-51.24983,NA,0.145,0,0,0.145,0.131,0,NA,0.131,0,0.029,0.055,0.008,0.025,0,0.025,0.014,0.072,0.005,0.001,0.018,0.001,0,NA,0.017,0.021,0.005,0.006,0.004,0.019,0,0.034,5,0,0.106,0.292,0.437,33.63844394,3,0.19489,0.180871261
25,25,01_02_V3_CLIVAR,1,NA,NA,NA,39,201.1,11/10/01,2001,11,10,09:39,143.1565,-51.24983,NA,0.031,0,0,0.031,0.043,0,NA,0.043,0,0.009,0.014,0.001,0.009,0,0.007,0.004,0.021,0.001,0,0.005,0,0,NA,0.003,0.004,0.001,0.001,0.001,0.005,0,0.008,5,0,0.029,0.086,0.117,47.00854701,3,0.05932,0.166385705
25,25,01_02_V3_CLIVAR,1,NA,NA,NA,42,5.1,11/10/01,2001,11,10,23:55,142.84433,-51.7975,NA,0.218,0,0.001,0.219,0.031,0,NA,0.031,0,0.031,0.077,0.022,0.038,0,0.091,0.003,0.154,0.003,0.001,0.168,0.015,0,NA,0.003,0.004,0.003,0.004,0.001,0.183,0,0.191,5,0,0.345,0.453,0.672,34.82142857,3,0.20832,0.615927419
25,25,01_02_V3_CLIVAR,1,NA,NA,NA,42,15.4,11/10/01,2001,11,10,23:55,142.84433,-51.7975,NA,0.225,0,0.003,0.228,0.036,0,NA,0.036,0,0.037,0.093,0.028,0.042,0,0.099,0,0.169,0.004,0.001,0.175,0.016,0,NA,0.003,0.007,0.006,0.005,0.004,0.191,0,0.206,5,0,0.375,0.504,0.732,37.70491803,3,0.23717,0.588565164
25,25,01_02_V3_CLIVAR,1,NA,NA,NA,42,29.6,11/10/01,2001,11,10,23:55,142.84433,-51.7975,NA,0.146,0,0,0.146,0.053,0,NA,0.053,0,0.032,0.071,0.007,0.042,0,0.071,0.006,0.126,0.003,0,0.05,0.003,0,NA,0.009,0.011,0.005,0.003,0.002,0.053,0,0.063,5,0,0.189,0.313,0.459,36.38344227,3,0.18379,0.544697753
25,25,01_02_V3_CLIVAR,1,NA,NA,NA,42,44.9,11/10/01,2001,11,10,23:55,142.84433,-51.7975,NA,0.284,0,0.001,0.285,0.083,0,NA,0.083,0,0.056,0.123,0.012,0.072,0,0.114,0.009,0.207,0.003,0.001,0.069,0.003,0,NA,0.01,0.013,0.004,0.004,0.003,0.072,0,0.083,5,0,0.29,0.496,0.781,27.01664533,3,0.29167,0.551102273
25,25,01_02_V3_CLIVAR,1,NA,NA,NA,42,59.7,11/10/01,2001,11,10,23:55,142.84433,-51.7975,NA,0.218,0,0,0.218,0.109,0,NA,0.109,0,0.056,0.111,0.015,0.074,0,0.082,0.011,0.182,0.003,0.001,0.036,0.002,0,NA,0.01,0.013,0.005,0.004,0.003,0.038,0,0.05,5,0,0.232,0.452,0.67,34.92537313,3,0.27834,0.415391248
25,25,01_02_V3_CLIVAR,1,NA,NA,NA,42,75.4,11/10/01,2001,11,10,23:55,142.84433,-51.7975,NA,0.13,0,0.001,0.131,0.1,0,NA,0.1,0,0.041,0.074,0.002,0.048,0,0.047,0.009,0.106,0.001,0.001,0.018,0.001,0,NA,0.007,0.009,0.005,0.002,0.002,0.019,0,0.028,5,0,0.134,0.308,0.439,40.31890661,3,0.19075,0.347418087
25,25,01_02_V3_CLIVAR,1,NA,NA,NA,42,91,11/10/01,2001,11,10,23:55,142.84433,-51.7975,NA,0.072,0,0,0.072,0.071,0,NA,0.071,0,0.021,0.038,0.004,0.029,0,0.025,0.007,0.065,0.002,0,0.012,0,0,NA,0.006,0.007,0.004,0.002,0.001,0.012,0,0.019,5,0,0.084,0.193,0.265,45.66037736,3,0.12687,0.277843462
25,25,01_02_V3_CLIVAR,1,NA,NA,NA,42,105.3,11/10/01,2001,11,10,23:55,142.84433,-51.7975,NA,0.035,0,0,0.035,0.044,0,NA,0.044,0,0.013,0.021,0,0.013,0,0.011,0.005,0.029,0.001,0,0.007,0,0,NA,0.006,0.007,0.003,0.001,0.001,0.007,0,0.012,5,0,0.041,0.106,0.141,50.35460993,3,0.06716,0.230941036
25,25,01_02_V3_CLIVAR,1,NA,NA,NA,42,120,11/10/01,2001,11,10,23:55,142.84433,-51.7975,NA,0.022,0,0,0.022,0.025,0,NA,0.025,0,0.007,0.012,0,0.009,0,0.008,0.003,0.02,0.001,0,0.004,0,0,NA,0.003,0.003,0.002,0.001,0,0.004,0,0.007,5,0,0.027,0.064,0.086,48.8372093,3,0.04174,0.27024437
25,25,01_02_V3_CLIVAR,1,NA,NA,NA,42,150,11/10/01,2001,11,10,23:55,142.84433,-51.7975,NA,0.034,0,0,0.034,0.044,0,NA,0.044,0,0.012,0.019,0.001,0.013,0,0.012,0.005,0.031,0.001,0,0.005,0,0,NA,0.004,0.004,0.002,0.001,0,0.005,0,0.008,5,0,0.039,0.102,0.136,50,3,0.06938,0.243874315
25,25,01_02_V3_CLIVAR,1,NA,NA,NA,42,251.2,11/10/01,2001,11,10,23:55,142.84433,-51.7975,NA,0.002,0,0,0.002,0.001,0,NA,0.001,0,0.001,0.001,0,0,0,0.002,0.001,0.003,0,0,0.001,0,0,NA,0,0,0.001,0,0,0.001,0,0.002,5,0,0.005,0.007,0.009,55.55555556,3,0.00443,0.636568849
25,25,01_02_V3_CLIVAR,1,NA,NA,NA,42,349.8,11/10/01,2001,11,10,23:55,142.84433,-51.7975,NA,0.001,0,0,0.001,0.001,0,NA,0.001,0,0,0,0,0.001,0,0.002,0,0.003,0,0,0,0,0,NA,0.001,0.001,0.001,0,0,0,0,0.001,5,0,0.004,0.005,0.006,66.66666667,3,0.00478,0.589958159
25,25,01_02_V3_CLIVAR,1,NA,NA,NA,43,6.1,11/11/01,2001,11,11,03:30,142.71517,-52.083,NA,0.194,0,0.01,0.204,0.029,0,NA,0.029,0,0.033,0.079,0.022,0.041,0,0.097,0.004,0.164,0.004,0.001,0.164,0.016,0,NA,0,0.002,0.005,0.005,0.002,0.18,0,0.192,5,0,0.356,0.464,0.668,38.92215569,3,0.21787,0.627759673
25,25,01_02_V3_CLIVAR,1,NA,NA,NA,43,52.4,11/11/01,2001,11,11,03:30,142.71517,-52.083,NA,0.237,0,0.016,0.253,0.046,0,NA,0.046,0,0.037,0.103,0.028,0.046,0,0.13,0.004,0.208,0.004,0.001,0.118,0.007,0,NA,0.005,0.005,0.004,0.005,0,0.125,0,0.134,5,0,0.342,0.491,0.744,31.98924731,3,0.29118,0.629507521
25,25,01_02_V3_CLIVAR,1,NA,NA,NA,43,101.6,11/11/01,2001,11,11,03:30,142.71517,-52.083,NA,0.045,0,0,0.045,0.04,0,NA,0.04,0,0.013,0.024,0.006,0.043,0,0.046,0.006,0.101,0.004,0,0.017,0.002,0,NA,0.007,0.008,0.004,0.004,0.001,0.019,0,0.028,5,0,0.129,0.193,0.238,62.18487395,3,0.13461,0.481836416
25,25,01_02_V3_CLIVAR,1,NA,NA,NA,43,151.4,11/11/01,2001,11,11,03:30,142.71517,-52.083,NA,0.004,0,0,0.004,0.003,0,NA,0.003,0,0,0.001,0.004,0.012,0,0.014,0.003,0.033,0.002,0,0.008,0.001,0,NA,0.004,0.004,0.002,0.002,0,0.009,0,0.013,5,0,0.046,0.05,0.054,85.18518519,3,0.03553,0.555586828
25,25,01_02_V3_CLIVAR,1,NA,NA,NA,43,200.9,11/11/01,2001,11,11,03:30,142.71517,-52.083,NA,0.003,0,0,0.003,0.003,0,NA,0.003,0,0,0.001,0,0.001,0,0.002,0.001,0.004,0.001,0,0.001,0,0,NA,0,0,0.001,0.001,0,0.001,0,0.003,5,0,0.007,0.011,0.014,57.14285714,3,0.00766,0.368146214
25,25,01_02_V3_CLIVAR,1,NA,NA,NA,43,251,11/11/01,2001,11,11,03:30,142.71517,-52.083,NA,0.001,0,0,0.001,0.001,0,NA,0.001,0,0,0.001,0,0,0,0.001,0.001,0.002,0,0,0.001,0,0,NA,0,0,0.001,0,0,0.001,0,0.002,5,0,0.004,0.006,0.007,71.42857143,3,0.00302,0.466887417
25,25,01_02_V3_CLIVAR,1,NA,NA,NA,45,5.5,11/11/01,2001,11,11,08:50,142.5335,-52.375,NA,0.154,0,0.014,0.168,0.024,0,NA,0.024,0,0.026,0.064,0.014,0.036,0,0.069,0.002,0.121,0.002,0,0.12,0.007,0,NA,0.002,0.004,0.002,0.002,0.002,0.127,0,0.133,5,0,0.254,0.342,0.51,34.11764706,3,0.15679,0.620511512
25,25,01_02_V3_CLIVAR,1,NA,NA,NA,45,49.7,11/11/01,2001,11,11,08:50,142.5335,-52.375,NA,0.429,0,0.013,0.442,0.085,0,NA,0.085,0,0.079,0.188,0.014,0.109,0,0.204,0.008,0.335,0.008,0,0.118,0.007,0,NA,0.013,0.017,0.005,0.008,0.004,0.125,0,0.142,5,0,0.477,0.75,1.192,25.83892617,3,0.44126,0.651860581
25,25,01_02_V3_CLIVAR,1,NA,NA,NA,45,99.9,11/11/01,2001,11,11,08:50,142.5335,-52.375,NA,0.109,0,0,0.109,0.083,0,NA,0.083,0,0.034,0.057,0.004,0.04,0,0.039,0.01,0.093,0.001,0.001,0.014,0.001,0,NA,0.011,0.013,0.003,0.002,0.002,0.015,0,0.022,5,0,0.115,0.255,0.364,40.10989011,3,0.16112,0.341298411
25,25,01_02_V3_CLIVAR,1,NA,NA,NA,45,149.9,11/11/01,2001,11,11,08:50,142.5335,-52.375,NA,0.013,0,0,0.013,0.017,0,NA,0.017,0,0.004,0.008,0.001,0.007,0,0.005,0.001,0.014,0.001,0,0.002,0.001,0,NA,0,0,0.001,0.001,0,0.003,0,0.005,5,0,0.019,0.044,0.057,54.38596491,3,0.02954,0.238659445
25,25,01_02_V3_CLIVAR,1,NA,NA,NA,45,225.7,11/11/01,2001,11,11,08:50,142.5335,-52.375,NA,0.003,0,0,0.003,0.001,0,NA,0.001,0,0,0.001,0,0.001,0,0.003,0,0.004,0,0,0,0,0,NA,0,0,0,0,0,0,0,0,5,0,0.004,0.006,0.009,33.33333333,3,0.00559,0.756708408
25,25,01_02_V3_CLIVAR,1,NA,NA,NA,47,5.5,11/11/01,2001,11,11,18:29,142.41133,-52.66317,NA,0.196,0,0.011,0.207,0.04,0,NA,0.04,0,0.033,0.078,0.013,0.045,0,0.101,0.006,0.165,0.004,0.001,0.136,0.006,0,NA,0.002,0.006,0.004,0.005,0.004,0.142,0,0.155,5,0,0.32,0.438,0.645,35.81395349,3,0.22273,0.639384008
25,25,01_02_V3_CLIVAR,1,NA,NA,NA,47,15.6,11/11/01,2001,11,11,18:29,142.41133,-52.66317,NA,0.161,0,0.011,0.172,0.034,0,NA,0.034,0,0.03,0.071,0.015,0.04,0,0.088,0.005,0.148,0.002,0,0.113,0.005,0,NA,0.005,0.008,0.004,0.002,0.003,0.118,0,0.127,5,0,0.275,0.38,0.552,37.68115942,3,0.19769,0.62764935
25,25,01_02_V3_CLIVAR,1,NA,NA,NA,47,29.9,11/11/01,2001,11,11,18:29,142.41133,-52.66317,NA,0.178,0,0.009,0.187,0.048,0,NA,0.048,0,0.029,0.075,0.019,0.042,0,0.1,0.006,0.167,0.003,0,0.082,0.004,0,NA,0.004,0.008,0.005,0.003,0.004,0.086,0,0.098,5,0,0.265,0.388,0.575,34.95652174,3,0.23655,0.596068484
25,25,01_02_V3_CLIVAR,1,NA,NA,NA,47,46.6,11/11/01,2001,11,11,18:29,142.41133,-52.66317,NA,0.187,0,0.008,0.195,0.051,0,NA,0.051,0,0.029,0.074,0.018,0.037,0,0.096,0.005,0.156,0.004,0,0.08,0.004,0,NA,0,0.004,0.005,0.004,0.004,0.084,0,0.097,5,0,0.253,0.378,0.573,31.93717277,3,0.23164,0.584355034
25,25,01_02_V3_CLIVAR,1,NA,NA,NA,47,59.9,11/11/01,2001,11,11,18:29,142.41133,-52.66317,NA,0.164,0,0.009,0.173,0.051,0,NA,0.051,0,0.029,0.072,0.018,0.039,0,0.089,0.008,0.154,0.004,0,0.065,0.003,0,NA,0,0.005,0.004,0.004,0.005,0.068,0,0.081,5,0,0.235,0.358,0.531,34.83992467,3,0.22187,0.565601478
25,25,01_02_V3_CLIVAR,1,NA,NA,NA,47,75.2,11/11/01,2001,11,11,18:29,142.41133,-52.66317,NA,0.188,0,0.003,0.191,0.099,0,NA,0.099,0,0.046,0.088,0.013,0.054,0,0.074,0.011,0.152,0.004,0,0.035,0.001,0,NA,0.013,0.017,0.005,0.004,0.004,0.036,0,0.049,5,0,0.201,0.388,0.579,34.02417962,3,0.248,0.420725806
25,25,01_02_V3_CLIVAR,1,NA,NA,NA,47,90.6,11/11/01,2001,11,11,18:29,142.41133,-52.66317,NA,0.118,0,0,0.118,0.098,0,NA,0.098,0,0.037,0.071,0.027,0.103,0,0.101,0,0.231,0,0,0,0,0,NA,0.032,0.032,0,0,0,0,0,0,5,0,0.231,0.4,0.518,54.44015444,3,0.31551,0.451364458
25,25,01_02_V3_CLIVAR,1,NA,NA,NA,47,105.2,11/11/01,2001,11,11,18:29,142.41133,-52.66317,NA,0.076,0,0.001,0.077,0.062,0,NA,0.062,0,0.023,0.042,0.003,0.031,0,0.033,0.007,0.074,0.002,0,0.013,0,0,NA,0.009,0.011,0.005,0.002,0.002,0.013,0,0.022,5,0,0.096,0.2,0.277,44.40433213,3,0.12895,0.360837534
25,25,01_02_V3_CLIVAR,1,NA,NA,NA,47,120.1,11/11/01,2001,11,11,18:29,142.41133,-52.66317,NA,0.087,0,0,0.087,0.07,0,NA,0.07,0,0.024,0.04,0.004,0.025,0,0.026,0.007,0.062,0.001,0,0.012,0,0,NA,0.008,0.01,0.003,0.001,0.002,0.012,0,0.018,5,0,0.08,0.19,0.277,37.18411552,3,0.12441,0.294670846
25,25,01_02_V3_CLIVAR,1,NA,NA,NA,47,151.7,11/11/01,2001,11,11,18:29,142.41133,-52.66317,NA,0.049,0,0,0.049,0.045,0,NA,0.045,0,0.014,0.025,0.003,0.017,0,0.021,0.005,0.046,0.002,0,0.011,0.001,0,NA,0.005,0.006,0.002,0.002,0.001,0.012,0,0.017,5,0,0.063,0.133,0.182,46.15384615,3,0.08816,0.335866606
25,25,01_02_V3_CLIVAR,1,NA,NA,NA,47,249.6,11/11/01,2001,11,11,18:29,142.41133,-52.66317,NA,0.001,0,0,0.001,0.001,0,NA,0.001,0,0,0,0.001,0.001,0,0.001,0,0.003,0,0,0.001,0,0,NA,0,0,0.001,0,0,0.001,0,0.002,5,0,0.005,0.006,0.007,71.42857143,3,0.00478,0.294979079
25,25,01_02_V3_CLIVAR,1,NA,NA,NA,48,9.2,11/11/01,2001,11,11,22:05,142.15633,-53.04433,NA,0.085,0,0.005,0.09,0.021,0,NA,0.021,0,0.012,0.033,0.01,0.02,0,0.055,0.002,0.087,0.003,0,0.077,0.005,0,NA,0.004,0.006,0.002,0.003,0.002,0.082,0,0.089,5,0,0.176,0.23,0.32,43.75,3,0.12364,0.627224199
25,25,01_02_V3_CLIVAR,1,NA,NA,NA,48,51.7,11/11/01,2001,11,11,22:05,142.15633,-53.04433,NA,0.127,0,0.005,0.132,0.031,0,NA,0.031,0,0.022,0.059,0.012,0.035,0,0.085,0.004,0.136,0.003,0.001,0.059,0.003,0,NA,0.002,0.005,0.005,0.004,0.003,0.062,0,0.074,5,0,0.21,0.3,0.432,38.88888889,3,0.18591,0.644666774
25,25,01_02_V3_CLIVAR,1,NA,NA,NA,48,98.1,11/11/01,2001,11,11,22:05,142.15633,-53.04433,NA,0.122,0,0.002,0.124,0.087,0,NA,0.087,0,0.034,0.066,0.011,0.046,0,0.067,0.009,0.133,0.004,0,0.022,0.002,0,NA,0.01,0.013,0.005,0.004,0.003,0.024,0,0.036,5,0,0.169,0.322,0.446,44.39461883,3,0.22039,0.428649213
25,25,01_02_V3_CLIVAR,1,NA,NA,NA,48,149.9,11/11/01,2001,11,11,22:05,142.15633,-53.04433,NA,0.062,0,0,0.062,0.036,0,NA,0.036,0,0.022,0.037,0.005,0.027,0,0.036,0.005,0.073,0.001,0,0.012,0,0,NA,0.006,0.007,0.002,0.001,0.001,0.012,0,0.016,5,0,0.089,0.162,0.224,44.64285714,3,0.10568,0.480317941
25,25,01_02_V3_CLIVAR,1,NA,NA,NA,48,199.7,11/11/01,2001,11,11,22:05,142.15633,-53.04433,NA,0.007,0,0,0.007,0.004,0,NA,0.004,0,0.002,0.004,0,0.003,0,0.006,0,0.009,0,0,0.002,0,0,NA,0,0,0,0,0,0.002,0,0.002,5,0,0.011,0.019,0.026,46.15384615,3,0.01355,0.624354244
25,25,01_02_V3_CLIVAR,1,NA,NA,NA,53,5.2,14/11/2001,2001,11,14,01:43,141.89217,-53.77717,NA,0.105,0,0.003,0.108,0.024,0,NA,0.024,0,0.02,0.048,0.006,0.026,0,0.064,0.001,0.097,0.002,0,0.085,0.006,0,NA,0,0.002,0,0.002,0.002,0.091,0,0.095,5,0,0.192,0.264,0.372,41.93548387,3,0.13376,0.674641148
25,25,01_02_V3_CLIVAR,1,NA,NA,NA,53,14.3,14/11/2001,2001,11,14,01:43,141.89217,-53.77717,NA,0.115,0,0.003,0.118,0.021,0,NA,0.021,0,0.017,0.045,0.008,0.026,0,0.061,0.001,0.096,0.003,0,0.087,0.006,0,NA,0.002,0.004,0.001,0.003,0.002,0.093,0,0.099,5,0,0.195,0.261,0.379,37.73087071,3,0.13078,0.657669368
25,25,01_02_V3_CLIVAR,1,NA,NA,NA,53,24.3,14/11/2001,2001,11,14,01:43,141.89217,-53.77717,NA,0.1,0,0.004,0.104,0.019,0,NA,0.019,0,0.015,0.04,0.006,0.022,0,0.06,0.001,0.089,0.003,0.001,0.074,0.005,0,NA,0.002,0.004,0.002,0.004,0.002,0.079,0,0.087,5,0,0.176,0.235,0.339,38.64306785,3,0.12373,0.683746868
25,25,01_02_V3_CLIVAR,1,NA,NA,NA,53,50,14/11/2001,2001,11,14,01:43,141.89217,-53.77717,NA,0.095,0,0.003,0.098,0.02,0,NA,0.02,0,0.015,0.04,0.008,0.023,0,0.061,0.003,0.095,0.002,0.001,0.077,0.003,0,NA,0,0.002,0.002,0.003,0.002,0.08,0,0.087,5,0,0.182,0.242,0.34,42.35294118,3,0.12846,0.669546941
25,25,01_02_V3_CLIVAR,1,NA,NA,NA,53,74.2,14/11/2001,2001,11,14,01:43,141.89217,-53.77717,NA,0.132,0,0.002,0.134,0.058,0,NA,0.058,0,0.028,0.068,0.005,0.052,0,0.09,0.008,0.155,0.003,0,0.042,0.003,0,NA,0.007,0.01,0.003,0.003,0.003,0.045,0,0.054,5,0,0.209,0.335,0.469,42.85714286,3,0.21511,0.589930733
25,25,01_02_V3_CLIVAR,1,NA,NA,NA,53,88.2,14/11/2001,2001,11,14,01:43,141.89217,-53.77717,NA,0.111,0,0.002,0.113,0.068,0,NA,0.068,0,0.032,0.067,0.009,0.052,0,0.068,0.007,0.136,0.002,0,0.025,0.001,0,NA,0.008,0.01,0.002,0.002,0.002,0.026,0,0.032,5,0,0.168,0.303,0.416,45.67307692,3,0.19837,0.483339215
25,25,01_02_V3_CLIVAR,1,NA,NA,NA,53,98.2,14/11/2001,2001,11,14,01:43,141.89217,-53.77717,NA,0.119,0,0.001,0.12,0.065,0,NA,0.065,0,0.032,0.061,0.009,0.044,0,0.056,0.007,0.116,0.001,0.001,0.019,0.001,0,NA,0.008,0.01,0.002,0.002,0.002,0.02,0,0.026,5,0,0.142,0.268,0.388,38.1443299,3,0.17476,0.451819638
25,25,01_02_V3_CLIVAR,1,NA,NA,NA,53,108.7,14/11/2001,2001,11,14,01:43,141.89217,-53.77717,NA,0.122,0,0.001,0.123,0.061,0,NA,0.061,0,0.032,0.06,0.005,0.043,0,0.055,0.006,0.109,0.001,0.001,0.017,0.001,0,NA,0.006,0.008,0.002,0.002,0.002,0.018,0,0.024,5,0,0.133,0.254,0.377,34.74801061,3,0.16332,0.47483468
25,25,01_02_V3_CLIVAR,1,NA,NA,NA,54,9.7,14/11/2001,2001,11,14,13:54,141.60667,-54.0565,NA,0.084,0,0.003,0.087,0.015,0,NA,0.015,0,0.014,0.038,0.009,0.021,0,0.063,0.003,0.096,0.003,0,0.068,0.003,0,NA,0,0.003,0.001,0.003,0.003,0.071,0,0.078,5,0,0.174,0.227,0.314,44.58598726,3,0.1272,0.698349057
25,25,01_02_V3_CLIVAR,1,NA,NA,NA,54,52,14/11/2001,2001,11,14,13:54,141.60667,-54.0565,NA,0.105,0,0.007,0.112,0.017,0,NA,0.017,0,0.017,0.043,0.012,0.02,0,0.072,0.002,0.106,0.003,0,0.072,0.003,0,NA,0,0.002,0.003,0.003,0.002,0.075,0,0.083,5,0,0.189,0.249,0.361,37.9501385,3,0.14699,0.690659229
25,25,01_02_V3_CLIVAR,1,NA,NA,NA,54,99.5,14/11/2001,2001,11,14,13:54,141.60667,-54.0565,NA,0.144,0,0.004,0.148,0.045,0,NA,0.045,0,0.035,0.079,0.012,0.057,0,0.105,0.004,0.178,0.003,0,0.028,0.002,0,NA,0.004,0.006,0.002,0.003,0.002,0.03,0,0.037,5,0,0.215,0.339,0.487,39.21971253,3,0.23415,0.632286996
25,25,01_02_V3_CLIVAR,1,NA,NA,NA,54,150.6,14/11/2001,2001,11,14,13:54,141.60667,-54.0565,NA,0.038,0,0,0.038,0.016,0,NA,0.016,0,0.013,0.022,0.003,0.018,0,0.024,0.002,0.047,0,0,0.008,0,0,NA,0,0,0.001,0,0,0.008,0,0.009,5,0,0.056,0.094,0.132,42.42424242,3,0.06113,0.55357435
25,25,01_02_V3_CLIVAR,1,NA,NA,NA,54,199.3,14/11/2001,2001,11,14,13:54,141.60667,-54.0565,NA,0.006,0,0,0.006,0.004,0,NA,0.004,0,0.003,0.005,0,0,0,0.006,0.001,0.007,0,0,0.002,0,0,NA,0,0.001,0,0,0.001,0.002,0,0.003,5,0,0.01,0.019,0.025,52,3,0.0125,0.6768
25,25,01_02_V3_CLIVAR,1,NA,NA,NA,55,4.8,14/11/2001,2001,11,14,19:35,141.33633,-54.52867,NA,0.112,0,0.003,0.115,0.013,0,NA,0.013,0,0.017,0.048,0.01,0.028,0,0.072,0.001,0.111,0.003,0,0.076,0.004,0,NA,0.002,0.004,0.004,0.003,0.002,0.08,0,0.089,5,0,0.2,0.261,0.376,38.82978723,3,0.14353,0.707308577
25,25,01_02_V3_CLIVAR,1,NA,NA,NA,55,14.5,14/11/2001,2001,11,14,19:35,141.33633,-54.52867,NA,0.099,0,0.004,0.103,0.013,0,NA,0.013,0,0.017,0.047,0.004,0.027,0,0.069,0,0.1,0.003,0,0.077,0.004,0,NA,0,0.002,0.004,0.003,0.002,0.081,0,0.09,5,0,0.19,0.25,0.353,41.64305949,3,0.13049,0.745574374
25,25,01_02_V3_CLIVAR,1,NA,NA,NA,55,30.4,14/11/2001,2001,11,14,19:35,141.33633,-54.52867,NA,0.113,0,0.003,0.116,0.015,0,NA,0.015,0,0.021,0.05,0.01,0.029,0,0.069,0.002,0.11,0.002,0,0.058,0.002,0,NA,0.002,0.003,0.003,0.002,0.001,0.06,0,0.066,5,0,0.176,0.241,0.357,35.0140056,3,0.14021,0.69388774
25,25,01_02_V3_CLIVAR,1,NA,NA,NA,55,44.8,14/11/2001,2001,11,14,19:35,141.33633,-54.52867,NA,0.118,0,0.005,0.123,0.012,0,NA,0.012,0,0.02,0.053,0.01,0.028,0,0.071,0.002,0.111,0.002,0,0.073,0.003,0,NA,0,0.002,0.003,0.002,0.002,0.076,0,0.083,5,0,0.194,0.259,0.382,35.60209424,3,0.13965,0.716863588
25,25,01_02_V3_CLIVAR,1,NA,NA,NA,55,59.9,14/11/2001,2001,11,14,19:35,141.33633,-54.52867,NA,0.107,0,0.003,0.11,0.014,0,NA,0.014,0,0.018,0.047,0.011,0.026,0,0.065,0,0.102,0.002,0,0.072,0.003,0,NA,0,0,0.004,0.002,0,0.075,0,0.081,5,0,0.183,0.244,0.354,37.85310734,3,0.13452,0.681311329
25,25,01_02_V3_CLIVAR,1,NA,NA,NA,55,75.9,14/11/2001,2001,11,14,19:35,141.33633,-54.52867,NA,0.194,0,0.005,0.199,0.034,0,NA,0.034,0,0.04,0.097,0.004,0.058,0,0.144,0.002,0.208,0.002,0,0.045,0.001,0,NA,0.003,0.005,0.002,0.002,0.002,0.046,0,0.052,5,0,0.26,0.391,0.59,32.54237288,3,0.26624,0.762620192
25,25,01_02_V3_CLIVAR,1,NA,NA,NA,55,91.1,14/11/2001,2001,11,14,19:35,141.33633,-54.52867,NA,0.165,0,0.002,0.167,0.045,0,NA,0.045,0,0.041,0.084,0.007,0.056,0,0.095,0.005,0.163,0.001,0.001,0.024,0.001,0,NA,0.006,0.008,0.003,0.002,0.002,0.025,0,0.032,5,0,0.195,0.324,0.491,31.97556008,3,0.21153,0.633243512
25,25,01_02_V3_CLIVAR,1,NA,NA,NA,55,104.8,14/11/2001,2001,11,14,19:35,141.33633,-54.52867,NA,0.159,0,0.002,0.161,0.046,0,NA,0.046,0,0.042,0.085,0.016,0.054,0,0.092,0.004,0.166,0.003,0,0.02,0.002,0,NA,0.003,0.004,0.003,0.003,0.001,0.022,0,0.029,5,0,0.195,0.326,0.487,33.88090349,3,0.22202,0.584271687
25,25,01_02_V3_CLIVAR,1,NA,NA,NA,55,118.9,14/11/2001,2001,11,14,19:35,141.33633,-54.52867,NA,0.115,0,0.001,0.116,0.044,0,NA,0.044,0,0.036,0.067,0.014,0.045,0,0.066,0.005,0.13,0.003,0,0.017,0.001,0,NA,0.002,0.003,0.003,0.003,0.001,0.018,0,0.025,5,0,0.155,0.266,0.382,39.26701571,3,0.17737,0.524665953
25,25,01_02_V3_CLIVAR,1,NA,NA,NA,55,150.3,14/11/2001,2001,11,14,19:35,141.33633,-54.52867,NA,0.045,0,0,0.045,0.017,0,NA,0.017,0,0.018,0.03,0.003,0.02,0,0.028,0.001,0.052,0.001,0,0.007,0,0,NA,0,0,0.001,0.001,0,0.007,0,0.009,5,0,0.061,0.108,0.153,41.17647059,3,0.06934,0.56936833
25,25,01_02_V3_CLIVAR,1,NA,NA,NA,55,249.7,14/11/2001,2001,11,14,19:35,141.33633,-54.52867,NA,0.001,0,0,0.001,0.001,0,NA,0.001,0,0,0,0,0,0,0.001,0.001,0.002,0,0,0,0,0,NA,0,0,0,0,0,0,0,0,5,0,0.002,0.003,0.004,50,3,0.00242,0.582644628
25,25,01_02_V3_CLIVAR,1,NA,NA,NA,57,10,15/11/2001,2001,11,15,03:45,141.02783,-55.01217,NA,0.111,0,0.003,0.114,0.014,0,NA,0.014,0,0.019,0.05,0.001,0.024,0,0.07,0,0.095,0.001,0,0.072,0.004,0,NA,0,0.001,0.003,0.001,0.001,0.076,0,0.081,5,0,0.176,0.24,0.354,35.59322034,3,0.12531,0.787646636
25,25,01_02_V3_CLIVAR,1,NA,NA,NA,57,50.9,15/11/2001,2001,11,15,03:45,141.02783,-55.01217,NA,0.136,0,0.004,0.14,0.015,0,NA,0.015,0,0.021,0.054,0.006,0.028,0,0.087,0,0.121,0.002,0,0.076,0.004,0,NA,0,0.002,0.002,0.002,0.002,0.08,0,0.086,5,0,0.207,0.276,0.416,32.69230769,3,0.159,0.771509434
25,25,01_02_V3_CLIVAR,1,NA,NA,NA,57,98.5,15/11/2001,2001,11,15,03:45,141.02783,-55.01217,NA,0.166,0,0.003,0.169,0.022,0,NA,0.022,0,0.028,0.072,0.006,0.038,0,0.112,0.001,0.157,0.003,0,0.043,0.002,0,NA,0,0.001,0.003,0.003,0.001,0.045,0,0.052,5,0,0.209,0.303,0.472,28.38983051,3,0.20628,0.765561373
25,25,01_02_V3_CLIVAR,1,NA,NA,NA,57,150.4,15/11/2001,2001,11,15,03:45,141.02783,-55.01217,NA,0.057,0,0,0.057,0.02,0,NA,0.02,0,0.02,0.034,0.006,0.023,0,0.03,0.002,0.061,0.001,0,0.01,0,0,NA,0.001,0.001,0.003,0.001,0,0.01,0,0.014,5,0,0.075,0.129,0.186,38.70967742,3,0.08167,0.517938043
25,25,01_02_V3_CLIVAR,1,NA,NA,NA,57,199.6,15/11/2001,2001,11,15,03:45,141.02783,-55.01217,NA,0.007,0,0,0.007,0.003,0,NA,0.003,0,0.002,0.004,0,0.004,0,0.005,0,0.009,0,0,0.002,0,0,NA,0,0,0.001,0,0,0.002,0,0.003,5,0,0.012,0.019,0.026,46.15384615,3,0.01208,0.583609272
25,25,01_02_V3_CLIVAR,1,NA,NA,NA,58,8.6,15/11/2001,2001,11,15,11:17,140.7325,-55.48867,NA,0.146,0,0.001,0.147,0.025,0,NA,0.025,0,0.021,0.052,0.011,0.03,0,0.072,0.003,0.116,0.002,0,0.078,0.004,0,NA,0.002,0.004,0.004,0.002,0.002,0.082,0,0.09,5,0,0.206,0.283,0.43,31.62790698,3,0.1569,0.647036329
25,25,01_02_V3_CLIVAR,1,NA,NA,NA,58,14.2,15/11/2001,2001,11,15,11:17,140.7325,-55.48867,NA,0.152,0,0.002,0.154,0.026,0,NA,0.026,0,0.025,0.061,0.016,0.033,0,0.079,0.003,0.131,0.002,0,0.086,0.005,0,NA,0.003,0.006,0.004,0.002,0.003,0.091,0,0.1,5,0,0.231,0.318,0.472,34.74576271,3,0.17588,0.633329543
25,25,01_02_V3_CLIVAR,1,NA,NA,NA,58,28.7,15/11/2001,2001,11,15,11:17,140.7325,-55.48867,NA,0.151,0,0.002,0.153,0.027,0,NA,0.027,0,0.024,0.057,0.009,0.03,0,0.072,0.003,0.114,0.002,0,0.08,0.004,0,NA,0.003,0.006,0.004,0.002,0.003,0.084,0,0.093,5,0,0.207,0.291,0.444,31.08108108,3,0.1561,0.650352338
25,25,01_02_V3_CLIVAR,1,NA,NA,NA,58,44.6,15/11/2001,2001,11,15,11:17,140.7325,-55.48867,NA,0.15,0,0.004,0.154,0.025,0,NA,0.025,0,0.023,0.057,0.014,0.029,0,0.075,0.002,0.12,0.002,0,0.076,0.004,0,NA,0,0.002,0.004,0.002,0.002,0.08,0,0.088,5,0,0.208,0.29,0.444,30.63063063,3,0.16501,0.64087025
25,25,01_02_V3_CLIVAR,1,NA,NA,NA,58,60.4,15/11/2001,2001,11,15,11:17,140.7325,-55.48867,NA,0.158,0,0.002,0.16,0.026,0,NA,0.026,0,0.024,0.058,0.011,0.03,0,0.077,0.002,0.12,0.002,0,0.077,0.004,0,NA,0.001,0.003,0.004,0.002,0.002,0.081,0,0.089,5,0,0.209,0.293,0.453,29.3598234,3,0.16496,0.658159554
25,25,01_02_V3_CLIVAR,1,NA,NA,NA,58,75.3,15/11/2001,2001,11,15,11:17,140.7325,-55.48867,NA,0.146,0,0.002,0.148,0.027,0,NA,0.027,0,0.022,0.058,0.013,0.031,0,0.081,0.002,0.127,0.002,0,0.077,0.005,0,NA,0,0.002,0.005,0.002,0.002,0.082,0,0.091,5,0,0.218,0.303,0.451,34.36807095,3,0.17538,0.651214506
25,25,01_02_V3_CLIVAR,1,NA,NA,NA,58,90.8,15/11/2001,2001,11,15,11:17,140.7325,-55.48867,NA,0.132,0,0.001,0.133,0.023,0,NA,0.023,0,0.021,0.053,0.009,0.027,0,0.068,0.003,0.107,0.002,0,0.049,0.002,0,NA,0.004,0.006,0.004,0.002,0.002,0.051,0,0.059,5,0,0.166,0.242,0.375,29.06666667,3,0.14537,0.659558368
25,25,01_02_V3_CLIVAR,1,NA,NA,NA,58,104.5,15/11/2001,2001,11,15,11:17,140.7325,-55.48867,NA,0.172,0,0.001,0.173,0.042,0,NA,0.042,0,0.037,0.075,0.009,0.04,0,0.095,0.005,0.149,0.001,0.002,0.031,0.001,0,NA,0.006,0.008,0.005,0.003,0.002,0.032,0,0.042,5,0,0.191,0.308,0.481,28.06652807,3,0.20692,0.647351633
25,25,01_02_V3_CLIVAR,1,NA,NA,NA,58,125.5,15/11/2001,2001,11,15,11:17,140.7325,-55.48867,NA,0.074,0,0,0.074,0.038,0,NA,0.038,0,0.025,0.042,0.007,0.028,0,0.037,0.004,0.076,0.001,0.001,0.01,0.001,0,NA,0.004,0.005,0.003,0.002,0.001,0.011,0,0.017,5,0,0.093,0.173,0.247,40.08097166,3,0.11288,0.462172218
25,25,01_02_V3_CLIVAR,1,NA,NA,NA,58,201.9,15/11/2001,2001,11,15,11:17,140.7325,-55.48867,NA,0.003,0,0,0.003,0.001,0,NA,0.001,0,0,0.001,0.001,0.002,0,0.004,0,0.007,0,0,0.001,0,0,NA,0,0,0.001,0,0,0.001,0,0.002,5,0,0.009,0.011,0.014,57.14285714,3,0.00936,0.602564103
25,25,01_02_V3_CLIVAR,1,NA,NA,NA,60,10.9,15/11/2001,2001,11,15,19:39,140.41833,-55.90483,NA,0.144,0,0.003,0.147,0.034,0,NA,0.034,0,0.024,0.06,0.012,0.032,0,0.091,0.003,0.138,0.002,0,0.082,0.005,0,NA,0.002,0.005,0.006,0.002,0.003,0.087,0,0.098,5,0,0.236,0.33,0.477,38.36477987,3,0.19609,0.654342394
25,25,01_02_V3_CLIVAR,1,NA,NA,NA,60,49.9,15/11/2001,2001,11,15,19:39,140.41833,-55.90483,NA,0.151,0,0.003,0.154,0.033,0,NA,0.033,0,0.027,0.063,0.016,0.032,0,0.097,0.005,0.15,0.001,0,0.08,0.003,0,NA,0.004,0.007,0.007,0.001,0.003,0.083,0,0.094,5,0,0.244,0.34,0.494,37.65182186,3,0.20892,0.654652499
25,25,01_02_V3_CLIVAR,1,NA,NA,NA,60,100.1,15/11/2001,2001,11,15,19:39,140.41833,-55.90483,NA,0.088,0,0.001,0.089,0.051,0,NA,0.051,0,0.027,0.052,0.006,0.032,0,0.063,0.006,0.107,0.002,0,0.024,0.001,0,NA,0,0.002,0.005,0.002,0.002,0.025,0,0.034,5,0,0.141,0.244,0.333,46.54654655,3,0.16472,0.539278776
25,25,01_02_V3_CLIVAR,1,NA,NA,NA,60,151.3,15/11/2001,2001,11,15,19:39,140.41833,-55.90483,NA,0.035,0,0,0.035,0.02,0,NA,0.02,0,0.011,0.019,0.004,0.014,0,0.025,0.002,0.045,0.001,0,0.008,0.001,0,NA,0.003,0.004,0.003,0.001,0.001,0.009,0,0.014,5,0,0.059,0.098,0.133,47.36842105,3,0.06865,0.513474144
25,25,01_02_V3_CLIVAR,1,NA,NA,NA,60,201.2,15/11/2001,2001,11,15,19:39,140.41833,-55.90483,NA,0.003,0,0,0.003,0.001,0,NA,0.001,0,0,0.001,0.001,0.002,0,0.004,0.001,0.008,0,0,0,0,0,NA,0,0,0.001,0,0,0,0,0.001,5,0,0.009,0.011,0.014,57.14285714,3,0.00936,0.602564103
25,25,01_02_V3_CLIVAR,1,NA,NA,NA,61,5.2,16/11/2001,2001,11,16,01:52,140.1175,-56.41933,NA,0.151,0,0.004,0.155,0.03,0,NA,0.03,0,0.02,0.053,0.011,0.028,0,0.087,0.005,0.131,0.002,0,0.083,0.004,0,NA,0.002,0.005,0.005,0.002,0.003,0.087,0,0.097,5,0,0.228,0.311,0.466,33.47639485,3,0.183,0.670327869
25,25,01_02_V3_CLIVAR,1,NA,NA,NA,61,24.6,16/11/2001,2001,11,16,01:52,140.1175,-56.41933,NA,0.152,0,0.005,0.157,0.028,0,NA,0.028,0,0.022,0.055,0.013,0.028,0,0.087,0.004,0.132,0.002,0,0.083,0.005,0,NA,0.004,0.007,0.005,0.002,0.003,0.088,0,0.098,5,0,0.23,0.313,0.47,33.19148936,3,0.1838,0.667410229
25,25,01_02_V3_CLIVAR,1,NA,NA,NA,61,50.6,16/11/2001,2001,11,16,01:52,140.1175,-56.41933,NA,0.149,0,0.006,0.155,0.032,0,NA,0.032,0,0.024,0.059,0.011,0.029,0,0.093,0.004,0.137,0.002,0.001,0.081,0.004,0,NA,0.004,0.007,0.005,0.003,0.003,0.085,0,0.096,5,0,0.233,0.324,0.479,35.28183716,3,0.19383,0.676520662
25,25,01_02_V3_CLIVAR,1,NA,NA,NA,61,99.9,16/11/2001,2001,11,16,01:52,140.1175,-56.41933,NA,0.127,0,0.002,0.129,0.049,0,NA,0.049,0,0.026,0.054,0.006,0.029,0,0.078,0.006,0.119,0.001,0.002,0.021,0.001,0,NA,0.003,0.005,0.006,0.003,0.002,0.022,0,0.033,5,0,0.152,0.255,0.384,32.8125,3,0.18254,0.602498083
25,25,01_02_V3_CLIVAR,1,NA,NA,NA,61,148.4,16/11/2001,2001,11,16,01:52,140.1175,-56.41933,NA,0.018,0,0,0.018,0.008,0,NA,0.008,0,0.007,0.012,0.002,0.007,0,0.014,0.001,0.024,0.001,0,0.005,0.001,0,NA,0.001,0.001,0.002,0.001,0,0.006,0,0.009,5,0,0.033,0.053,0.071,49.29577465,3,0.03515,0.561593172
25,25,01_02_V3_CLIVAR,1,NA,NA,NA,65,7.2,16/11/2001,2001,11,16,19:56,139.93367,-56.87883,NA,0.169,0,0.002,0.171,0.033,0,NA,0.033,0,0.028,0.066,0.013,0.035,0,0.09,0.003,0.141,0.002,0,0.066,0.003,0,NA,0,0.003,0.007,0.002,0.003,0.069,0,0.081,5,0,0.222,0.321,0.492,30.48780488,3,0.19673,0.64504651
25,25,01_02_V3_CLIVAR,1,NA,NA,NA,65,20.1,16/11/2001,2001,11,16,19:56,139.93367,-56.87883,NA,0.186,0,0.004,0.19,0.036,0,NA,0.036,0,0.029,0.07,0.009,0.035,0,0.095,0.003,0.142,0.003,0,0.066,0.003,0,NA,0.003,0.005,0.006,0.003,0.002,0.069,0,0.08,5,0,0.222,0.328,0.518,26.64092664,3,0.20143,0.664995284
25,25,01_02_V3_CLIVAR,1,NA,NA,NA,65,39,16/11/2001,2001,11,16,19:56,139.93367,-56.87883,NA,0.189,0,0.003,0.192,0.034,0,NA,0.034,0,0.03,0.073,0.007,0.037,0,0.1,0.004,0.148,0.002,0.001,0.065,0.003,0,NA,0.003,0.005,0.006,0.003,0.002,0.068,0,0.079,5,0,0.227,0.334,0.526,26.99619772,3,0.20348,0.692942795
25,25,01_02_V3_CLIVAR,1,NA,NA,NA,65,58.4,16/11/2001,2001,11,16,19:56,139.93367,-56.87883,NA,0.178,0,0.004,0.182,0.035,0,NA,0.035,0,0.029,0.068,0.013,0.035,0,0.091,0.004,0.143,0.002,0,0.056,0.002,0,NA,0.003,0.006,0.005,0.002,0.003,0.058,0,0.068,5,0,0.211,0.314,0.496,26.61290323,3,0.19896,0.644903498
25,25,01_02_V3_CLIVAR,1,NA,NA,NA,65,80.3,16/11/2001,2001,11,16,19:56,139.93367,-56.87883,NA,0.181,0,0.003,0.184,0.038,0,NA,0.038,0,0.033,0.077,0.012,0.039,0,0.103,0.005,0.159,0.003,0,0.048,0.002,0,NA,0.004,0.006,0.006,0.003,0.002,0.05,0,0.061,5,0,0.22,0.335,0.519,29.09441233,3,0.22036,0.659057905
25,25,01_02_V3_CLIVAR,1,NA,NA,NA,65,99,16/11/2001,2001,11,16,19:56,139.93367,-56.87883,NA,0.212,0,0.003,0.215,0.037,0,NA,0.037,0,0.037,0.084,0.011,0.043,0,0.115,0.004,0.173,0.004,0,0.045,0.002,0,NA,0.004,0.006,0.006,0.004,0.002,0.047,0,0.059,5,0,0.232,0.353,0.568,24.29577465,3,0.23712,0.683830972
25,25,01_02_V3_CLIVAR,1,NA,NA,NA,65,113.6,16/11/2001,2001,11,16,19:56,139.93367,-56.87883,NA,0.171,0,0.002,0.173,0.037,0,NA,0.037,0,0.034,0.076,0.012,0.039,0,0.107,0.004,0.162,0.003,0,0.036,0.003,0,NA,0.003,0.005,0.006,0.003,0.002,0.039,0,0.05,5,0,0.212,0.325,0.498,30.52208835,3,0.22499,0.670563136
25,25,01_02_V3_CLIVAR,1,NA,NA,NA,65,150.4,16/11/2001,2001,11,16,19:56,139.93367,-56.87883,NA,0.031,0,0,0.031,0.021,0,NA,0.021,0,0.01,0.017,0.004,0.013,0,0.026,0.002,0.045,0.001,0.001,0.007,0,0,NA,0,0,0.001,0.002,0,0.007,0,0.01,5,0,0.055,0.093,0.124,50,3,0.06952,0.527330265
25,25,01_02_V3_CLIVAR,1,NA,NA,NA,68,5.9,17/11/2001,2001,11,17,20:09,139.82617,-58.8355,NA,0.18,0,0.004,0.184,0.031,0,NA,0.031,0,0.029,0.069,0.012,0.039,0,0.097,0.002,0.15,0.003,0,0.089,0.004,0,NA,0.002,0.005,0.006,0.003,0.003,0.093,0,0.105,5,0,0.255,0.355,0.539,31.72541744,3,0.20483,0.667724454
25,25,01_02_V3_CLIVAR,1,NA,NA,NA,68,15.7,17/11/2001,2001,11,17,20:09,139.82617,-58.8355,NA,0.16,0,0.002,0.162,0.029,0,NA,0.029,0,0.024,0.062,0.006,0.034,0,0.094,0.002,0.136,0.003,0,0.083,0.005,0,NA,0,0.002,0.007,0.003,0.002,0.088,0,0.1,5,0,0.236,0.327,0.489,33.74233129,3,0.18897,0.701381172
25,25,01_02_V3_CLIVAR,1,NA,NA,NA,68,30.4,17/11/2001,2001,11,17,20:09,139.82617,-58.8355,NA,0.168,0,0.002,0.17,0.028,0,NA,0.028,0,0.025,0.063,0.008,0.038,0,0.097,0.001,0.144,0.002,0,0.073,0.003,0,NA,0.003,0.005,0.006,0.002,0.002,0.076,0,0.086,5,0,0.23,0.321,0.491,30.75356415,3,0.19495,0.701564504
25,25,01_02_V3_CLIVAR,1,NA,NA,NA,68,45.8,17/11/2001,2001,11,17,20:09,139.82617,-58.8355,NA,0.163,0,0.004,0.167,0.029,0,NA,0.029,0,0.029,0.07,0.014,0.037,0,0.1,0.003,0.154,0.001,0.001,0.072,0.003,0,NA,0,0.003,0.008,0.002,0.003,0.075,0,0.088,5,0,0.242,0.341,0.508,34.2519685,3,0.20864,0.675805215
25,25,01_02_V3_CLIVAR,1,NA,NA,NA,68,60.3,17/11/2001,2001,11,17,20:09,139.82617,-58.8355,NA,0.16,0,0.003,0.163,0.027,0,NA,0.027,0,0.025,0.062,0.01,0.039,0,0.091,0.004,0.144,0.002,0,0.069,0.004,0,NA,0.005,0.007,0.008,0.002,0.002,0.073,0,0.085,5,0,0.229,0.318,0.481,32.22453222,3,0.18985,0.675849355
25,25,01_02_V3_CLIVAR,1,NA,NA,NA,68,75.5,17/11/2001,2001,11,17,20:09,139.82617,-58.8355,NA,0.181,0,0.004,0.185,0.029,0,NA,0.029,0,0.026,0.066,0.012,0.037,0,0.106,0.002,0.157,0.002,0,0.071,0.002,0,NA,0,0.003,0.006,0.002,0.003,0.073,0,0.084,5,0,0.241,0.336,0.521,28.98272553,3,0.21394,0.698607086
25,25,01_02_V3_CLIVAR,1,NA,NA,NA,68,90.6,17/11/2001,2001,11,17,20:09,139.82617,-58.8355,NA,0.174,0,0.004,0.178,0.027,0,NA,0.027,0,0.03,0.073,0.017,0.039,0,0.115,0.005,0.176,0.003,0,0.075,0.003,0,NA,0.004,0.007,0.006,0.003,0.003,0.078,0,0.09,5,0,0.266,0.366,0.544,34.55882353,3,0.23322,0.695266272
25,25,01_02_V3_CLIVAR,1,NA,NA,NA,68,105.6,17/11/2001,2001,11,17,20:09,139.82617,-58.8355,NA,0.175,0,0.003,0.178,0.026,0,NA,0.026,0,0.027,0.067,0.008,0.036,0,0.103,0.003,0.15,0.002,0,0.068,0.003,0,NA,0.002,0.004,0.008,0.002,0.002,0.071,0,0.083,5,0,0.233,0.326,0.504,29.36507937,3,0.20189,0.719352122
25,25,01_02_V3_CLIVAR,1,NA,NA,NA,68,120.7,17/11/2001,2001,11,17,20:09,139.82617,-58.8355,NA,0.163,0,0.004,0.167,0.027,0,NA,0.027,0,0.028,0.069,0.016,0.038,0,0.107,0.002,0.163,0.002,0,0.066,0.003,0,NA,0,0.003,0.007,0.002,0.003,0.069,0,0.081,5,0,0.244,0.34,0.507,34.12228797,3,0.21992,0.68602219
25,25,01_02_V3_CLIVAR,1,NA,NA,NA,68,151,17/11/2001,2001,11,17,20:09,139.82617,-58.8355,NA,0.051,0,0,0.051,0.016,0,NA,0.016,0,0.016,0.03,0,0.017,0,0.046,0,0.063,0.001,0.001,0.014,0,0,NA,0,0,0.005,0.002,0,0.014,0,0.021,5,0,0.084,0.13,0.181,43.64640884,3,0.09083,0.714081251
25,25,01_02_V3_CLIVAR,1,NA,NA,NA,68,201.5,17/11/2001,2001,11,17,20:09,139.82617,-58.8355,NA,0.002,0,0,0.002,0,0,NA,0,0,0,0.001,0,0,0,0.003,0.001,0.004,0,0,0.004,0,0,NA,0,0.001,0.001,0,0.001,0.004,0,0.006,5,0,0.01,0.011,0.013,69.23076923,3,0.00483,0.875776398
25,25,01_02_V3_CLIVAR,1,NA,NA,NA,66,10.4,17/11/2001,2001,11,17,20:13,139.83993,-57.8445,NA,0.152,0,0.003,0.155,0.031,0,NA,0.031,0,0.024,0.063,0.008,0.034,0,0.104,0.003,0.149,0.001,0,0.068,0.003,0,NA,0.003,0.005,0.002,0.001,0.002,0.071,0,0.076,5,0,0.225,0.319,0.474,34.59915612,3,0.20319,0.72168906
25,25,01_02_V3_CLIVAR,1,NA,NA,NA,66,50.8,17/11/2001,2001,11,17,20:13,139.83993,-57.8445,NA,0.168,0,0.002,0.17,0.03,0,NA,0.03,0,0.026,0.066,0.008,0.035,0,0.107,0.002,0.152,0.002,0,0.068,0.003,0,NA,0,0.002,0.004,0.002,0.002,0.071,0,0.079,5,0,0.231,0.327,0.497,31.58953722,3,0.20882,0.722488267
25,25,01_02_V3_CLIVAR,1,NA,NA,NA,66,99.6,17/11/2001,2001,11,17,20:13,139.83993,-57.8445,NA,0.156,0,0.004,0.16,0.029,0,NA,0.029,0,0.027,0.07,0.008,0.037,0,0.114,0,0.159,0.002,0,0.063,0.002,0,NA,0.003,0.004,0.004,0.002,0.001,0.065,0,0.072,5,0,0.231,0.33,0.49,34.69387755,3,0.21838,0.736056415
25,25,01_02_V3_CLIVAR,1,NA,NA,NA,66,149.5,17/11/2001,2001,11,17,20:13,139.83993,-57.8445,NA,0.054,0,0,0.054,0.019,0,NA,0.019,0,0.017,0.031,0.004,0.021,0,0.043,0.002,0.07,0.001,0.001,0.01,0,0,NA,0,0,0.004,0.002,0,0.01,0,0.016,5,0,0.086,0.136,0.19,43.15789474,3,0.09607,0.631102321
25,25,01_02_V3_CLIVAR,1,NA,NA,NA,66,198.8,17/11/2001,2001,11,17,20:13,139.83993,-57.8445,NA,0.004,0,0,0.004,0.001,0,NA,0.001,0,0,0.001,0,0.002,0,0.006,0,0.008,0,0,0.002,0,0,NA,0,0,0.002,0,0,0.002,0,0.004,5,0,0.012,0.014,0.018,55.55555556,3,0.01137,0.744063325
25,25,01_02_V3_CLIVAR,1,NA,NA,NA,69,5.3,18/11/2001,2001,11,18,23:33,139.98983,-59.349,NA,0.224,0,0.007,0.231,0.012,0,NA,0.012,0,0.036,0.099,0.018,0.035,0,0.193,0.002,0.248,0.002,0,0.133,0.009,0,NA,0,0.001,0.006,0.002,0.001,0.142,0,0.151,5,0,0.399,0.51,0.741,37.65182186,3,0.3272,0.831693154
25,25,01_02_V3_CLIVAR,1,NA,NA,NA,69,50.2,18/11/2001,2001,11,18,23:33,139.98983,-59.349,NA,0.248,0,0.007,0.255,0.013,0,NA,0.013,0,0.036,0.104,0.021,0.036,0,0.212,0,0.269,0.003,0,0.126,0.008,0,NA,0,0.001,0.005,0.003,0.001,0.134,0,0.143,5,0,0.412,0.529,0.784,34.94897959,3,0.35984,0.830702534
25,25,01_02_V3_CLIVAR,1,NA,NA,NA,69,101.1,18/11/2001,2001,11,18,23:33,139.98983,-59.349,NA,0.288,0,0.009,0.297,0.015,0,NA,0.015,0,0.044,0.123,0.027,0.041,0,0.243,0.002,0.313,0.001,0.003,0.11,0.004,0,NA,0,0,0.007,0.004,0,0.114,0,0.125,5,0,0.438,0.576,0.873,31.95876289,3,0.41526,0.825097529
25,25,01_02_V3_CLIVAR,1,NA,NA,NA,69,126.5,18/11/2001,2001,11,18,23:33,139.98983,-59.349,NA,0.226,0,0.01,0.236,0.014,0,NA,0.014,0,0.04,0.101,0.022,0.032,0,0.203,0,0.257,0.002,0.003,0.076,0.002,0,NA,0,0.001,0.006,0.005,0.001,0.078,0,0.09,5,0,0.347,0.462,0.698,32.3782235,3,0.34791,0.822712771
25,25,01_02_V3_CLIVAR,1,NA,NA,NA,69,174.8,18/11/2001,2001,11,18,23:33,139.98983,-59.349,NA,0.064,0,0.001,0.065,0.016,0,NA,0.016,0,0.023,0.042,0.01,0.012,0,0.068,0.003,0.093,0.003,0.001,0.014,0.001,0,NA,0,0,0.004,0.004,0,0.015,0,0.023,5,0,0.116,0.174,0.239,45.60669456,3,0.13532,0.708542714
25,25,01_02_V3_CLIVAR,1,NA,NA,NA,70,5.6,19/11/2001,2001,11,19,06:09,139.85367,-59.848,NA,0.341,0,0.036,0.377,0.015,0,NA,0.015,0,0.072,0.183,0.023,0.034,0,0.33,0,0.387,0.002,0,0.179,0.009,0,NA,0,0.002,0.005,0.002,0.002,0.188,0,0.197,5,0,0.584,0.782,1.159,34.94391717,3,0.5295,0.878753541
25,25,01_02_V3_CLIVAR,1,NA,NA,NA,70,14.4,19/11/2001,2001,11,19,06:09,139.85367,-59.848,NA,0.358,0,0.023,0.381,0.013,0,NA,0.013,0,0.063,0.166,0.017,0.037,0,0.327,0,0.381,0.003,0,0.178,0.008,0,NA,0,0.001,0.005,0.003,0.001,0.186,0,0.195,5,0,0.576,0.755,1.136,32.92253521,3,0.5167,0.892335978
25,25,01_02_V3_CLIVAR,1,NA,NA,NA,70,39.5,19/11/2001,2001,11,19,06:09,139.85367,-59.848,NA,0.428,0,0.026,0.454,0.015,0,NA,0.015,0,0.07,0.184,0.022,0.036,0,0.376,0,0.434,0.003,0,0.156,0.006,0,NA,0.002,0.003,0.007,0.003,0.001,0.162,0,0.173,5,0,0.607,0.806,1.26,27.93650794,3,0.59571,0.889963237
25,25,01_02_V3_CLIVAR,1,NA,NA,NA,70,65.2,19/11/2001,2001,11,19,06:09,139.85367,-59.848,NA,0.348,0,0.018,0.366,0.014,0,NA,0.014,0,0.065,0.163,0.023,0.035,0,0.316,0,0.374,0.004,0,0.111,0.004,0,NA,0,0,0.006,0.004,0,0.115,0,0.125,5,0,0.499,0.676,1.042,29.75047985,3,0.51142,0.871221305
25,25,01_02_V3_CLIVAR,1,NA,NA,NA,70,100.2,19/11/2001,2001,11,19,06:09,139.85367,-59.848,NA,0.424,0,0.028,0.452,0.011,0,NA,0.011,0,0.076,0.204,0.026,0.031,0,0.404,0.001,0.462,0.003,0,0.125,0.004,0,NA,0.002,0.002,0.007,0.003,0,0.129,0,0.139,5,0,0.601,0.816,1.268,28.70662461,3,0.63504,0.897014361
25,25,01_02_V3_CLIVAR,1,NA,NA,NA,70,124.8,19/11/2001,2001,11,19,06:09,139.85367,-59.848,NA,0.214,0,0.007,0.221,0.013,0,NA,0.013,0,0.049,0.104,0.015,0.019,0,0.218,0,0.252,0.004,0.001,0.045,0.001,0,NA,0,0,0.008,0.005,0,0.046,0,0.059,5,0,0.311,0.428,0.649,31.89522342,3,0.35655,0.862095078
25,25,01_02_V3_CLIVAR,1,NA,NA,NA,70,139.3,19/11/2001,2001,11,19,06:09,139.85367,-59.848,NA,0.135,0,0.005,0.14,0.012,0,NA,0.012,0,0.037,0.073,0.012,0.014,0,0.149,0,0.175,0.004,0.002,0.029,0.001,0,NA,0.002,0.003,0.005,0.006,0.001,0.03,0,0.042,5,0,0.217,0.302,0.442,36.65158371,3,0.25047,0.838783088
25,25,01_02_V3_CLIVAR,2,NA,NA,NA,70,139.3,19/11/2001,2001,11,19,06:09,139.85367,-59.848,NA,0.011,0,0,0.011,0.003,0,NA,0.003,0,0.005,0.009,0.003,0.004,0,0.014,0.001,0.022,0,0,0.003,0,0,NA,0,0,0.002,0,0,0.003,0,0.005,5,0,0.027,0.039,0.05,56,3,0.0296,0.666891892
25,25,01_02_V3_CLIVAR,1,NA,NA,NA,70,180.4,19/11/2001,2001,11,19,06:09,139.85367,-59.848,NA,0.006,0,0,0.006,0.002,0,NA,0.002,0,0.001,0.003,0,0.002,0,0.008,0,0.01,0,0,0.002,0,0,NA,0,0,0,0,0,0.002,0,0.002,5,0,0.012,0.017,0.023,47.82608696,3,0.014,0.805714286
25,25,01_02_V3_CLIVAR,1,NA,NA,NA,70,199.5,19/11/2001,2001,11,19,06:09,139.85367,-59.848,NA,0.004,0,0,0.004,0.003,0,NA,0.003,0,0.001,0.002,0.001,0,0,0.006,0.001,0.008,0,0,0.001,0,0,NA,0.001,0.001,0.001,0,0,0.001,0,0.002,5,0,0.01,0.015,0.019,57.89473684,3,0.0135,0.626666667
25,25,01_02_V3_CLIVAR,1,NA,NA,NA,72,10.3,19/11/2001,2001,11,19,14:07,139.85867,-60.33583,NA,0.301,0,0.013,0.314,0.015,0,NA,0.015,0,0.047,0.126,0.02,0.038,0,0.247,0,0.305,0.002,0,0.145,0.005,0,NA,0,0.002,0.005,0.002,0.002,0.15,0,0.159,5,0,0.464,0.605,0.919,31.6648531,3,0.40964,0.850185529
25,25,01_02_V3_CLIVAR,1,NA,NA,NA,72,49.8,19/11/2001,2001,11,19,14:07,139.85867,-60.33583,NA,0.268,0,0.009,0.277,0.015,0,NA,0.015,0,0.047,0.127,0.015,0.033,0,0.233,0.002,0.283,0.003,0,0.118,0.007,0,NA,0,0,0.004,0.003,0,0.125,0,0.132,5,0,0.415,0.557,0.834,33.57314149,3,0.38136,0.861469478
25,25,01_02_V3_CLIVAR,1,NA,NA,NA,72,100,19/11/2001,2001,11,19,14:07,139.85867,-60.33583,NA,0.332,0,0.015,0.347,0.015,0,NA,0.015,0,0.068,0.159,0.014,0.032,0,0.279,0.001,0.326,0.002,0,0.078,0.002,0,NA,0,0,0.006,0.002,0,0.08,0,0.088,5,0,0.414,0.588,0.935,25.77540107,3,0.4448,0.884419964
25,25,01_02_V3_CLIVAR,1,NA,NA,NA,72,150.3,19/11/2001,2001,11,19,14:07,139.85867,-60.33583,NA,0.004,0,0,0.004,0.001,0,NA,0.001,0,0.001,0.003,0,0.001,0,0.005,0,0.006,0,0,0.001,0,0,NA,0,0,0.001,0,0,0.001,0,0.002,5,0,0.008,0.012,0.016,50,3,0.00901,0.782463929
25,25,01_02_V3_CLIVAR,1,NA,NA,NA,72,200.4,19/11/2001,2001,11,19,14:07,139.85867,-60.33583,NA,0.002,0,0,0.002,0.002,0,NA,0.002,0,0,0.001,0.001,0.001,0,0.003,0,0.005,0,0,0.001,0,0,NA,0,0,0.001,0,0,0.001,0,0.002,5,0,0.007,0.01,0.012,66.66666667,3,0.00861,0.491289199
25,25,01_02_V3_CLIVAR,1,NA,NA,NA,74,5.7,21/11/2001,2001,11,21,00:27,139.8645,-60.84633,NA,0.36,0,0.013,0.373,0.012,0,NA,0.012,0,0.066,0.173,0.018,0.03,0,0.324,0,0.372,0.002,0,0.166,0.008,0,NA,0,0.001,0.005,0.002,0.001,0.174,0,0.182,5,0,0.554,0.739,1.112,32.91366906,3,0.50956,0.89653819
25,25,01_02_V3_CLIVAR,1,NA,NA,NA,74,21.3,21/11/2001,2001,11,21,00:27,139.8645,-60.84633,NA,0.353,0,0.011,0.364,0.012,0,NA,0.012,0,0.065,0.168,0.017,0.031,0,0.332,0,0.38,0.003,0,0.167,0.009,0,NA,0,0.001,0.006,0.003,0.001,0.176,0,0.186,5,0,0.566,0.746,1.11,34.41441441,3,0.52124,0.898089172
25,25,01_02_V3_CLIVAR,1,NA,NA,NA,74,40.3,21/11/2001,2001,11,21,00:27,139.8645,-60.84633,NA,0.381,0,0.014,0.395,0.003,0,NA,0.003,0,0.071,0.186,0.022,0.033,0,0.347,0.001,0.403,0.002,0,0.165,0.008,0,NA,0,0.002,0.006,0.002,0.002,0.173,0,0.183,5,0,0.586,0.775,1.17,32.47863248,3,0.54019,0.90573687
25,25,01_02_V3_CLIVAR,1,NA,NA,NA,74,60.9,21/11/2001,2001,11,21,00:27,139.8645,-60.84633,NA,0.389,0,0.025,0.414,0.002,0,NA,0.002,0,0.075,0.193,0.023,0.035,0,0.374,0.002,0.434,0.003,0,0.163,0.008,0,NA,0.003,0.004,0.006,0.003,0.001,0.171,0,0.181,5,0,0.615,0.81,1.224,32.35294118,3,0.58022,0.908862156
25,25,01_02_V3_CLIVAR,1,NA,NA,NA,74,76,21/11/2001,2001,11,21,00:27,139.8645,-60.84633,NA,0.391,0,0.02,0.411,0.005,0,NA,0.005,0,0.067,0.183,0.016,0.032,0,0.35,0,0.398,0.003,0,0.154,0.006,0,NA,0,0,0.006,0.003,0,0.16,0,0.169,5,0,0.567,0.755,1.166,29.5025729,3,0.53849,0.916451559
25,25,01_02_V3_CLIVAR,1,NA,NA,NA,74,85.5,21/11/2001,2001,11,21,00:27,139.8645,-60.84633,NA,0.38,0,0.019,0.399,0.014,0,NA,0.014,0,0.07,0.185,0.018,0.032,0,0.36,0.001,0.411,0.003,0,0.145,0.005,0,NA,0,0.002,0.005,0.003,0.002,0.15,0,0.16,5,0,0.571,0.77,1.169,31.73652695,3,0.5639,0.900159603
25,25,01_02_V3_CLIVAR,1,NA,NA,NA,74,100.7,21/11/2001,2001,11,21,00:27,139.8645,-60.84633,NA,0.174,0,0.005,0.179,0.01,0,NA,0.01,0,0.044,0.093,0.008,0.018,0,0.174,0,0.2,0.002,0,0.043,0.002,0,NA,0.001,0.002,0.006,0.002,0.001,0.045,0,0.054,5,0,0.254,0.357,0.536,33.20895522,3,0.27834,0.881439966
25,25,01_02_V3_CLIVAR,1,NA,NA,NA,74,125.8,21/11/2001,2001,11,21,00:27,139.8645,-60.84633,NA,0.008,0,0,0.008,0.002,0,NA,0.002,0,0.003,0.006,0,0.003,0,0.011,0.001,0.015,0,0,0.002,0,0,NA,0.001,0.001,0.002,0,0,0.002,0,0.004,5,0,0.019,0.027,0.035,54.28571429,3,0.01978,0.784125379
25,25,01_02_V3_CLIVAR,1,NA,NA,NA,77,10,22/11/2001,2001,11,22,04:47,139.85133,-61.3435,NA,0.41,0,0.026,0.436,0.01,0,NA,0.01,0,0.076,0.209,0.018,0.032,0,0.425,0.002,0.477,0.003,0,0.205,0.011,0,NA,0.004,0.005,0.006,0.003,0.001,0.216,0,0.226,5,0,0.703,0.922,1.358,35.78792342,3,0.65211,0.918940056
25,25,01_02_V3_CLIVAR,1,NA,NA,NA,77,25.2,22/11/2001,2001,11,22,04:47,139.85133,-61.3435,NA,0.396,0,0.02,0.416,0.011,0,NA,0.011,0,0.07,0.196,0.024,0.031,0,0.401,0.004,0.46,0.002,0,0.2,0.01,0,NA,0.002,0.004,0.005,0.002,0.002,0.21,0,0.219,5,0,0.679,0.886,1.302,36.09831029,3,0.62593,0.903311872
25,25,01_02_V3_CLIVAR,1,NA,NA,NA,77,51.2,22/11/2001,2001,11,22,04:47,139.85133,-61.3435,NA,0.412,0,0.024,0.436,0.011,0,NA,0.011,0,0.068,0.188,0.028,0.034,0,0.392,0,0.454,0.003,0,0.192,0.01,0,NA,0.003,0.004,0.005,0.003,0.001,0.202,0,0.211,5,0,0.665,0.864,1.3,32.92307692,3,0.62079,0.890349394
25,25,01_02_V3_CLIVAR,1,NA,NA,NA,77,74.5,22/11/2001,2001,11,22,04:47,139.85133,-61.3435,NA,0.413,0,0.021,0.434,0.01,0,NA,0.01,0,0.064,0.179,0.024,0.032,0,0.414,0.003,0.473,0.002,0.002,0.162,0.006,0,NA,0.003,0.004,0.006,0.004,0.001,0.168,0,0.179,5,0,0.652,0.841,1.275,31.92156863,3,0.6442,0.906147159
25,25,01_02_V3_CLIVAR,1,NA,NA,NA,77,98.6,22/11/2001,2001,11,22,04:47,139.85133,-61.3435,NA,0.251,0,0.013,0.264,0.009,0,NA,0.009,0,0.051,0.119,0.014,0.019,0,0.258,0.002,0.293,0.003,0.001,0.06,0.001,0,NA,0.002,0.002,0.009,0.004,0,0.061,0,0.074,5,0,0.367,0.495,0.759,30.43478261,3,0.40724,0.893281603
25,25,01_02_V3_CLIVAR,1,NA,NA,NA,77,130.3,22/11/2001,2001,11,22,04:47,139.85133,-61.3435,NA,0.015,0,0,0.015,0.004,0,NA,0.004,0,0.004,0.009,0.001,0.005,0,0.019,0.001,0.026,0.002,0,0.004,0.001,0,NA,0,0,0.002,0.002,0,0.005,0,0.009,5,0,0.035,0.048,0.063,52.38095238,3,0.03691,0.725819561
25,25,01_02_V3_CLIVAR,1,NA,NA,NA,77,151,22/11/2001,2001,11,22,04:47,139.85133,-61.3435,NA,0.005,0,0,0.005,0,0,NA,0,0,0.002,0.004,0.001,0,0,0.008,0.001,0.01,0,0,0,0,0,NA,0,0,0.001,0,0,0,0,0.001,5,0,0.011,0.015,0.02,50,3,0.01329,0.848758465
25,25,01_02_V3_CLIVAR,1,NA,NA,NA,79,9.8,22/11/2001,2001,11,22,14:36,139.84633,-61.849,NA,0.558,0,0.031,0.589,0.009,0,NA,0.009,0,0.079,0.236,0.038,0.029,0,0.487,0.003,0.557,0.002,0.001,0.262,0.015,0,NA,0,0,0.008,0.003,0,0.277,0,0.288,5,0,0.845,1.09,1.679,29.83918999,3,0.76601,0.896424329
25,25,01_02_V3_CLIVAR,1,NA,NA,NA,79,50.1,22/11/2001,2001,11,22,14:36,139.84633,-61.849,NA,0.512,0,0.043,0.555,0.009,0,NA,0.009,0,0.081,0.231,0.042,0.034,0,0.489,0.007,0.572,0.003,0.003,0.216,0.012,0,NA,0,0.002,0.008,0.006,0.002,0.228,0,0.244,5,0,0.816,1.056,1.611,31.09869646,3,0.77708,0.887283163
25,25,01_02_V3_CLIVAR,1,NA,NA,NA,79,89.7,22/11/2001,2001,11,22,14:36,139.84633,-61.849,NA,0.291,0,0.015,0.306,0.013,0,NA,0.013,0,0.064,0.144,0.017,0.021,0,0.303,0.002,0.343,0.004,0.007,0.068,0.003,0,NA,0.002,0.002,0.009,0.011,0,0.071,0,0.091,5,0,0.434,0.591,0.897,31.77257525,3,0.48052,0.889099309
25,25,01_02_V3_CLIVAR,1,NA,NA,NA,79,129.9,22/11/2001,2001,11,22,14:36,139.84633,-61.849,NA,0.014,0,0,0.014,0.002,0,NA,0.002,0,0.005,0.01,0.002,0.004,0,0.021,0,0.027,0.001,0,0.005,0,0,NA,0,0,0.002,0.001,0,0.005,0,0.008,5,0,0.035,0.047,0.061,54.09836066,3,0.03791,0.781060406
25,25,01_02_V3_CLIVAR,1,NA,NA,NA,79,179.3,22/11/2001,2001,11,22,14:36,139.84633,-61.849,NA,0.003,0,0,0.003,0.001,0,NA,0.001,0,0.002,0.005,0,0.001,0,0.011,0,0.012,0.001,0,0.002,0.001,0,NA,0,0,0.001,0.001,0,0.003,0,0.005,5,0,0.017,0.023,0.026,76.92307692,3,0.01833,0.846153846
25,25,01_02_V3_CLIVAR,1,NA,NA,NA,81,4.6,23/11/2001,2001,11,23,02:25,139.828,-62.35867,NA,0.376,0,0.021,0.397,0.007,0,NA,0.007,0,0.043,0.129,0.029,0.02,0,0.286,0,0.335,0.002,0,0.199,0.016,0,NA,0.003,0.004,0.006,0.002,0.001,0.215,0,0.224,5,0,0.559,0.695,1.092,27.28937729,3,0.46354,0.869957285
25,25,01_02_V3_CLIVAR,1,NA,NA,NA,81,20,23/11/2001,2001,11,23,02:25,139.828,-62.35867,NA,0.371,0,0.024,0.395,0.01,0,NA,0.01,0,0.047,0.136,0.03,0.022,0,0.296,0,0.348,0.003,0,0.164,0.012,0,NA,0.003,0.004,0.006,0.003,0.001,0.176,0,0.186,5,0,0.534,0.68,1.075,26.51162791,3,0.48364,0.862955918
25,25,01_02_V3_CLIVAR,1,NA,NA,NA,81,39.9,23/11/2001,2001,11,23,02:25,139.828,-62.35867,NA,0.373,0,0.022,0.395,0.009,0,NA,0.009,0,0.049,0.141,0.03,0.024,0,0.296,0,0.35,0.003,0,0.161,0.009,0,NA,0,0.001,0.006,0.003,0.001,0.17,0,0.18,5,0,0.53,0.68,1.075,26.51162791,3,0.48333,0.863509404
25,25,01_02_V3_CLIVAR,1,NA,NA,NA,81,59.2,23/11/2001,2001,11,23,02:25,139.828,-62.35867,NA,0.405,0,0.019,0.424,0.008,0,NA,0.008,0,0.065,0.183,0.033,0.03,0,0.342,0,0.405,0.003,0,0.165,0.01,0,NA,0.004,0.006,0.006,0.003,0.002,0.175,0,0.186,5,0,0.591,0.782,1.206,29.68490879,3,0.55351,0.871203772
25,25,01_02_V3_CLIVAR,1,NA,NA,NA,81,79.3,23/11/2001,2001,11,23,02:25,139.828,-62.35867,NA,0.237,0,0.007,0.244,0.011,0,NA,0.011,0,0.039,0.093,0.021,0.02,0,0.196,0,0.237,0.004,0.001,0.049,0.002,0,NA,0,0,0.008,0.005,0,0.051,0,0.064,5,0,0.301,0.405,0.649,24.80739599,3,0.33232,0.831608089
25,25,01_02_V3_CLIVAR,1,NA,NA,NA,81,79.6,23/11/2001,2001,11,23,02:25,139.828,-62.35867,NA,0.102,0,0.002,0.104,0.009,0,NA,0.009,0,0.024,0.049,0.013,0.017,0,0.097,0.001,0.128,0.006,0.001,0.017,0.001,0,NA,0,0.001,0.007,0.007,0.001,0.018,0,0.033,5,0,0.161,0.219,0.323,35.60371517,3,0.1795,0.761949861
25,25,01_02_V3_CLIVAR,1,NA,NA,NA,81,89.2,23/11/2001,2001,11,23,02:25,139.828,-62.35867,NA,0.032,0,0.001,0.033,0.004,0,NA,0.004,0,0.009,0.017,0.004,0.008,0,0.032,0.001,0.045,0.003,0,0.006,0,0,NA,0,0,0.004,0.003,0,0.006,0,0.013,5,0,0.058,0.079,0.112,41.07142857,3,0.06258,0.720997124
25,25,01_02_V3_CLIVAR,2,NA,NA,NA,81,89.2,23/11/2001,2001,11,23,02:25,139.828,-62.35867,NA,0.011,0,0,0.011,0.001,0,NA,0.001,0,0.003,0.006,0.001,0.004,0,0.013,0.001,0.019,0.002,0,0.002,0,0,NA,0,0,0.002,0.002,0,0.002,0,0.006,5,0,0.025,0.032,0.043,48.8372093,3,0.02507,0.731152772
25,25,01_02_V3_CLIVAR,1,NA,NA,NA,81,119.9,23/11/2001,2001,11,23,02:25,139.828,-62.35867,NA,0.005,0,0,0.005,0.001,0,NA,0.001,0,0.002,0.004,0.002,0.002,0,0.007,0,0.011,0.001,0,0.002,0,0,NA,0,0,0.001,0.001,0,0.002,0,0.004,5,0,0.015,0.02,0.025,60,3,0.01586,0.622320303
25,25,01_02_V3_CLIVAR,1,NA,NA,NA,82,4.8,24/11/2001,2001,11,24,05:04,139.8635,-62.83067,NA,0.46,0,0.022,0.482,0.012,0,NA,0.012,0,0.067,0.2,0.046,0.029,0,0.394,0,0.469,0.004,0,0.209,0.013,0,NA,0,0,0.011,0.004,0,0.222,0,0.237,5,0,0.706,0.918,1.4,31.14285714,3,0.65271,0.851128372
25,25,01_02_V3_CLIVAR,1,NA,NA,NA,82,50.2,24/11/2001,2001,11,24,05:04,139.8635,-62.83067,NA,0.454,0,0.012,0.466,0.012,0,NA,0.012,0,0.058,0.183,0.034,0.025,0,0.371,0,0.43,0.002,0.003,0.161,0.007,0,NA,0,0,0.009,0.005,0,0.168,0,0.182,5,0,0.612,0.807,1.273,26.78711705,3,0.59904,0.873247196
25,25,01_02_V3_CLIVAR,1,NA,NA,NA,82,99.3,24/11/2001,2001,11,24,05:04,139.8635,-62.83067,NA,0.138,0,0.003,0.141,0.013,0,NA,0.013,0,0.043,0.081,0.016,0.022,0,0.136,0,0.174,0.01,0.002,0.024,0.002,0,NA,0,0,0.007,0.012,0,0.026,0,0.045,5,0,0.219,0.313,0.454,37.88546256,3,0.24795,0.77338173
25,25,01_02_V3_CLIVAR,1,NA,NA,NA,82,150,24/11/2001,2001,11,24,05:04,139.8635,-62.83067,NA,0.018,0,0,0.018,0.003,0,NA,0.003,0,0.005,0.011,0.004,0.006,0,0.021,0,0.031,0.002,0,0.006,0.001,0,NA,0,0,0.004,0.002,0,0.007,0,0.013,5,0,0.044,0.058,0.076,52.63157895,3,0.0445,0.665393258
25,25,01_02_V3_CLIVAR,1,NA,NA,NA,82,200.6,24/11/2001,2001,11,24,05:04,139.8635,-62.83067,NA,0.014,0,0,0.014,0.003,0,NA,0.003,0,0.006,0.01,0,0.003,0,0.014,0,0.017,0.001,0.001,0.005,0,0,NA,0,0,0.003,0.002,0,0.005,0,0.01,5,0,0.027,0.04,0.054,48.14814815,3,0.02648,0.745468278
25,25,01_02_V3_CLIVAR,1,NA,NA,NA,84,4.6,24/11/2001,2001,11,24,16:48,139.878,-63.36117,NA,0.443,0,0.029,0.472,0.009,0,NA,0.009,0,0.055,0.163,0.028,0.026,0,0.343,0,0.397,0.004,0,0.216,0.013,0,NA,0,0,0.01,0.004,0,0.229,0,0.243,5,0,0.64,0.812,1.284,26.47975078,3,0.55074,0.878145768
25,25,01_02_V3_CLIVAR,1,NA,NA,NA,84,14.6,24/11/2001,2001,11,24,16:48,139.878,-63.36117,NA,0.397,0,0.036,0.433,0.008,0,NA,0.008,0,0.054,0.157,0.026,0.028,0,0.328,0,0.382,0.002,0.004,0.205,0.014,0,NA,0.003,0.006,0.01,0.006,0.003,0.219,0,0.238,5,0,0.62,0.785,1.218,28.8998358,3,0.52474,0.881350764
25,25,01_02_V3_CLIVAR,1,NA,NA,NA,84,29.6,24/11/2001,2001,11,24,16:48,139.878,-63.36117,NA,0.411,0,0.049,0.46,0.01,0,NA,0.01,0,0.064,0.182,0.022,0.024,0,0.346,0,0.392,0.006,0,0.224,0.012,0,NA,0,0,0.011,0.006,0,0.236,0,0.253,5,0,0.645,0.837,1.297,29.06707787,3,0.54914,0.888407328
25,25,01_02_V3_CLIVAR,1,NA,NA,NA,84,44.6,24/11/2001,2001,11,24,16:48,139.878,-63.36117,NA,0.497,0,0.05,0.547,0.01,0,NA,0.01,0,0.073,0.21,0.035,0.031,0,0.42,0,0.486,0.003,0.005,0.208,0.012,0,NA,0,0.001,0.011,0.008,0.001,0.22,0,0.24,5,0,0.726,0.946,1.493,26.72471534,3,0.67168,0.881669843
25,25,01_02_V3_CLIVAR,2,NA,NA,NA,84,44.6,24/11/2001,2001,11,24,16:48,139.878,-63.36117,NA,0.489,0,0.07,0.559,0.01,0,NA,0.01,0,0.077,0.218,0.036,0.034,0,0.444,0.002,0.516,0.003,0.006,0.222,0.012,0,NA,0,0.002,0.012,0.009,0.002,0.234,0,0.257,5,0,0.773,1.001,1.56,28.33333333,3,0.70858,0.883513506
25,25,01_02_V3_CLIVAR,3,NA,NA,NA,84,44.6,24/11/2001,2001,11,24,16:48,139.878,-63.36117,NA,0.401,0,0.023,0.424,0.015,0,NA,0.015,0,0.08,0.187,0.015,0.04,0,0.361,0,0.416,0.009,0.003,0.078,0.004,0,NA,0,0.001,0.011,0.012,0.001,0.082,0,0.106,5,0,0.522,0.724,1.148,26.13240418,3,0.57365,0.887318051
25,25,01_02_V3_CLIVAR,1,NA,NA,NA,84,74.9,24/11/2001,2001,11,24,16:48,139.878,-63.36117,NA,0.207,0,0.007,0.214,0.013,0,NA,0.013,0,0.054,0.103,0.015,0.032,0,0.192,0,0.239,0.001,0.001,0.033,0.002,0,NA,0,0,0.006,0.002,0,0.035,0,0.043,5,0,0.282,0.398,0.612,30.06535948,3,0.32066,0.844258716
25,25,01_02_V3_CLIVAR,1,NA,NA,NA,84,89,24/11/2001,2001,11,24,16:48,139.878,-63.36117,NA,0.118,0,0.007,0.125,0.012,0,NA,0.012,0,0.036,0.063,0.006,0.026,0,0.11,0.002,0.144,0.006,0.001,0.016,0.001,0,NA,0,0,0.005,0.007,0,0.017,0,0.029,5,0,0.173,0.248,0.373,32.97587131,3,0.19294,0.803876853
25,25,01_02_V3_CLIVAR,1,NA,NA,NA,84,119.9,24/11/2001,2001,11,24,16:48,139.878,-63.36117,NA,0.058,0,0.001,0.059,0.008,0,NA,0.008,0,0.015,0.029,0.001,0.018,0,0.056,0.001,0.076,0.004,0,0.01,0.001,0,NA,0,0,0.004,0.004,0,0.011,0,0.019,5,0,0.095,0.132,0.191,38.21989529,3,0.10059,0.784968685
25,25,01_02_V3_CLIVAR,2,NA,NA,NA,84,119.9,24/11/2001,2001,11,24,16:48,139.878,-63.36117,NA,0.03,0,0.001,0.031,0.004,0,NA,0.004,0,0.011,0.02,0,0.009,0,0.034,0.001,0.044,0.003,0,0.008,0.001,0,NA,0.001,0.001,0.003,0.003,0,0.009,0,0.015,5,0,0.059,0.083,0.114,45.61403509,3,0.05951,0.805578894
25,25,01_02_V3_CLIVAR,1,NA,NA,NA,84,149.4,24/11/2001,2001,11,24,16:48,139.878,-63.36117,NA,0.009,0,0,0.009,0.002,0,NA,0.002,0,0.004,0.007,0.002,0.004,0,0.014,0.001,0.021,0.002,0.001,0.003,0,0,NA,0,0,0.002,0.003,0,0.003,0,0.008,5,0,0.029,0.038,0.047,61.70212766,3,0.0289,0.683044983
25,25,01_02_V3_CLIVAR,1,NA,NA,NA,84,199.8,24/11/2001,2001,11,24,16:48,139.878,-63.36117,NA,0.005,0,0,0.005,0,0,NA,0,0,0.002,0.004,0,0.002,0,0.008,0.001,0.011,0.002,0,0.004,0.001,0,NA,0,0,0.003,0.002,0,0.005,0,0.01,5,0,0.021,0.025,0.03,66.66666667,3,0.0155,0.727741935
25,25,01_02_V3_CLIVAR,1,NA,NA,NA,86,5,25/11/2001,2001,11,25,00:31,139.85583,-63.89667,NA,0.326,0,0.016,0.342,0.009,0,NA,0.009,0,0.045,0.124,0.041,0.021,0,0.255,0,0.317,0.003,0,0.163,0.016,0,NA,0.003,0.005,0.01,0.003,0.002,0.179,0,0.194,5,0,0.511,0.644,0.986,30.62880325,3,0.44238,0.812762783
25,25,01_02_V3_CLIVAR,1,NA,NA,NA,86,20.3,25/11/2001,2001,11,25,00:31,139.85583,-63.89667,NA,0.316,0,0.014,0.33,0.011,0,NA,0.011,0,0.034,0.109,0.036,0.023,0,0.242,0,0.301,0,0.001,0.159,0.014,0,NA,0,0.002,0.008,0.001,0.002,0.173,0,0.184,5,0,0.485,0.605,0.935,29.41176471,3,0.41594,0.820358706
25,25,01_02_V3_CLIVAR,1,NA,NA,NA,86,45.4,25/11/2001,2001,11,25,00:31,139.85583,-63.89667,NA,0.356,0,0.013,0.369,0.012,0,NA,0.012,0,0.051,0.146,0.04,0.03,0,0.317,0.001,0.388,0.005,0.003,0.09,0.004,0,NA,0,0,0.012,0.008,0,0.094,0,0.114,5,0,0.502,0.66,1.029,28.27988338,3,0.53749,0.831587564
25,25,01_02_V3_CLIVAR,1,NA,NA,NA,86,61.3,25/11/2001,2001,11,25,00:31,139.85583,-63.89667,NA,0.256,0,0.013,0.269,0.012,0,NA,0.012,0,0.044,0.111,0.021,0.031,0,0.234,0,0.286,0.005,0.003,0.044,0.003,0,NA,0,0,0.009,0.008,0,0.047,0,0.064,5,0,0.35,0.473,0.742,27.49326146,3,0.39222,0.841211565
25,25,01_02_V3_CLIVAR,1,NA,NA,NA,86,69.9,25/11/2001,2001,11,25,00:31,139.85583,-63.89667,NA,0.117,0,0.002,0.119,0.009,0,NA,0.009,0,0.029,0.058,0.009,0.029,0,0.103,0.001,0.142,0.003,0.001,0.019,0,0,NA,0,0,0.006,0.004,0,0.019,0,0.029,5,0,0.171,0.238,0.357,33.33333333,3,0.18334,0.792134831
25,25,01_02_V3_CLIVAR,1,NA,NA,NA,86,85.3,25/11/2001,2001,11,25,00:31,139.85583,-63.89667,NA,0.046,0,0,0.046,0.003,0,NA,0.003,0,0.014,0.026,0,0.016,0,0.037,0.001,0.054,0.002,0.001,0.007,0.001,0,NA,0,0,0.003,0.003,0,0.008,0,0.014,5,0,0.068,0.097,0.143,35.66433566,3,0.06432,0.811100746
25,25,01_02_V3_CLIVAR,1,NA,NA,NA,86,100.8,25/11/2001,2001,11,25,00:31,139.85583,-63.89667,NA,0.02,0,0,0.02,0.004,0,NA,0.004,0,0.006,0.012,0,0.011,0,0.023,0,0.034,0.002,0,0.004,0,0,NA,0,0.001,0.004,0.002,0.001,0.004,0,0.011,5,0,0.045,0.061,0.081,50.61728395,3,0.04444,0.729747975
25,25,01_02_V3_CLIVAR,1,NA,NA,NA,86,114.8,25/11/2001,2001,11,25,00:31,139.85583,-63.89667,NA,0.018,0,0,0.018,0.004,0,NA,0.004,0,0.005,0.01,0,0.008,0,0.021,0.002,0.031,0.002,0,0.005,0,0,NA,0,0,0.002,0.002,0,0.005,0,0.009,5,0,0.04,0.054,0.072,50,3,0.03937,0.752095504
25,25,01_02_V3_CLIVAR,1,NA,NA,NA,89,6.4,26/11/2001,2001,11,26,07:50,140.41733,-64.1705,NA,0.348,0,0.023,0.371,0.01,0,NA,0.01,0,0.043,0.131,0.04,0.027,0,0.279,0,0.346,0.002,0.003,0.148,0.01,0,NA,0,0.002,0.009,0.005,0.002,0.158,0,0.174,5,0,0.52,0.661,1.032,28.10077519,3,0.47646,0.825651681
25,25,01_02_V3_CLIVAR,1,NA,NA,NA,89,49.7,26/11/2001,2001,11,26,07:50,140.41733,-64.1705,NA,0.215,0,0.009,0.224,0.018,0,NA,0.018,0,0.034,0.08,0.004,0.037,0,0.228,0.002,0.271,0.006,0.002,0.046,0.003,0,NA,0,0.001,0.006,0.008,0.001,0.049,0,0.064,5,0,0.335,0.433,0.657,31.81126332,3,0.36701,0.875943435
25,25,01_02_V3_CLIVAR,1,NA,NA,NA,89,80.7,26/11/2001,2001,11,26,07:50,140.41733,-64.1705,NA,0.038,0,0.001,0.039,0.005,0,NA,0.005,0,0.01,0.024,0.001,0.01,0,0.047,0.001,0.059,0.002,0.001,0.012,0.002,0,NA,0.002,0.002,0.002,0.003,0,0.014,0,0.019,5,0,0.078,0.107,0.146,46.57534247,3,0.07915,0.837271004
25,25,01_02_V3_CLIVAR,1,NA,NA,NA,89,119.7,26/11/2001,2001,11,26,07:50,140.41733,-64.1705,NA,0.018,0,0,0.018,0.004,0,NA,0.004,0,0.006,0.011,0.004,0.004,0,0.023,0.001,0.032,0.001,0.001,0.004,0.001,0,NA,0.002,0.002,0.002,0.002,0,0.005,0,0.009,5,0,0.041,0.056,0.074,51.35135135,3,0.04557,0.711652403
25,25,01_02_V3_CLIVAR,1,NA,NA,NA,92,5.1,27/11/2001,2001,11,27,00:31,141.89217,-64.77717,NA,0.541,0,0.054,0.595,0.014,0,NA,0.014,0,0.056,0.174,0.042,0.03,0,0.358,0.001,0.431,0.005,0,0.268,0.02,0,NA,0,0,0.008,0.005,0,0.288,0,0.301,5,0,0.732,0.92,1.515,21.45214521,3,0.59774,0.844480878
25,25,01_02_V3_CLIVAR,1,NA,NA,NA,92,15.2,27/11/2001,2001,11,27,00:31,141.89217,-64.77717,NA,0.686,0,0.074,0.76,0.014,0,NA,0.014,0,0.083,0.334,0.039,0.033,0,0.496,0.001,0.569,0.006,0,0.352,0.023,0,NA,0.003,0.005,0.009,0.006,0.002,0.375,0,0.392,5,0,0.961,1.309,2.069,26.53455776,3,0.7906,0.884593979
25,25,01_02_V3_CLIVAR,1,NA,NA,NA,92,29.5,27/11/2001,2001,11,27,00:31,141.89217,-64.77717,NA,0.719,0,0.048,0.767,0.014,0,NA,0.014,0,0.079,0.239,0.046,0.036,0,0.502,0,0.584,0.007,0,0.286,0.017,0,NA,0,0,0.01,0.007,0,0.303,0,0.32,5,0,0.904,1.157,1.924,20.27027027,3,0.81144,0.872301094
25,25,01_02_V3_CLIVAR,1,NA,NA,NA,92,44.8,27/11/2001,2001,11,27,00:31,141.89217,-64.77717,NA,0.588,0,0.039,0.627,0.03,0,NA,0.03,0,0.078,0.258,0.038,0.04,0,0.389,0.002,0.469,0.006,0,0.136,0.006,0,NA,0,0.003,0.009,0.006,0.003,0.142,0,0.16,5,0,0.629,0.917,1.544,18.78238342,3,0.65693,0.83492914
25,25,01_02_V3_CLIVAR,2,NA,NA,NA,92,44.8,27/11/2001,2001,11,27,00:31,141.89217,-64.77717,NA,0.258,0,0.012,0.27,0.037,0,NA,0.037,0,0.053,0.113,0.018,0.04,0,0.162,0.002,0.222,0.005,0,0.047,0.002,0,NA,0.002,0.004,0.003,0.005,0.002,0.049,0,0.059,5,0,0.281,0.431,0.701,22.96718973,3,0.31127,0.733832364
25,25,01_02_V3_CLIVAR,1,NA,NA,NA,92,74.5,27/11/2001,2001,11,27,00:31,141.89217,-64.77717,NA,0.119,0,0.002,0.121,0.023,0,NA,0.023,0,0.021,0.046,0.009,0.03,0,0.08,0.001,0.12,0.002,0.002,0.019,0,0,NA,0,0,0.003,0.004,0,0.019,0,0.026,5,0,0.146,0.215,0.336,27.97619048,3,0.16274,0.693130146
25,25,01_02_V3_CLIVAR,1,NA,NA,NA,92,90,27/11/2001,2001,11,27,00:31,141.89217,-64.77717,NA,0.049,0,0.001,0.05,0.01,0,NA,0.01,0,0.014,0.026,0.004,0.018,0,0.041,0.001,0.064,0.002,0.001,0.008,0,0,NA,0.001,0.001,0.002,0.003,0,0.008,0,0.013,5,0,0.077,0.113,0.163,38.65030675,3,0.08277,0.698441464
25,25,01_02_V3_CLIVAR,1,NA,NA,NA,92,119.7,27/11/2001,2001,11,27,00:31,141.89217,-64.77717,NA,0.021,0,0,0.021,0.006,0,NA,0.006,0,0.008,0.013,0,0.01,0,0.022,0.001,0.033,0.001,0,0.005,0.001,0,NA,0,0.001,0.001,0.001,0.001,0.006,0,0.009,5,0,0.042,0.061,0.082,48.7804878,3,0.04204,0.737868696
25,25,01_02_V3_CLIVAR,1,NA,NA,NA,92,119.9,27/11/2001,2001,11,27,00:31,141.89217,-64.77717,NA,0.02,0,0,0.02,0.005,0,NA,0.005,0,0.007,0.012,0.001,0.01,0,0.021,0.001,0.033,0,0,0.005,0.001,0,NA,0,0,0.003,0,0,0.006,0,0.009,5,0,0.042,0.059,0.079,49.36708861,3,0.04137,0.715736041
25,25,01_02_V3_CLIVAR,1,NA,NA,NA,92,150.9,27/11/2001,2001,11,27,00:31,141.89217,-64.77717,NA,0.007,0,0,0.007,0.001,0,NA,0.001,0,0.002,0.005,0.001,0.003,0,0.011,0,0.015,0,0,0.003,0.001,0,NA,0,0,0.001,0,0,0.004,0,0.005,5,0,0.02,0.026,0.033,57.57575758,3,0.01958,0.792134831
25,25,01_02_V3_CLIVAR,2,NA,NA,NA,92,150.9,27/11/2001,2001,11,27,00:31,141.89217,-64.77717,NA,0.24,0,0.019,0.259,0.011,0,NA,0.011,0,0.032,0.088,0.02,0.018,0,0.185,0.001,0.224,0.002,0.001,0.066,0.003,0,NA,0.002,0.003,0.004,0.003,0.001,0.069,0,0.077,5,0,0.301,0.4,0.659,21.39605463,3,0.31058,0.839880224
25,25,01_02_V3_CLIVAR,1,NA,NA,NA,93,5.4,27/11/2001,2001,11,27,04:40,142.43433,-65.02333,NA,0.3,0,0.01,0.31,0.022,0,NA,0.022,0,0.033,0.092,0.013,0.026,0,0.171,0.001,0.211,0.003,0.001,0.133,0.011,0,NA,0.003,0.004,0.007,0.004,0.001,0.144,0,0.156,5,0,0.367,0.481,0.791,21.6182048,3,0.29754,0.810344828
25,25,01_02_V3_CLIVAR,1,NA,NA,NA,93,29.8,27/11/2001,2001,11,27,04:40,142.43433,-65.02333,NA,0.293,0,0.009,0.302,0.029,0,NA,0.029,0,0.036,0.094,0.02,0.031,0,0.165,0.001,0.217,0.003,0.001,0.096,0.006,0,NA,0,0.002,0.008,0.004,0.002,0.102,0,0.116,5,0,0.333,0.456,0.758,20.31662269,3,0.30837,0.754450822
